sku,title,sub_title,brand,product_url,description,product_specification,price,old_price,image,in_stock,is_sponsored,discount_value,rating,reviews,e_retailer,client,market,type,position,listing_url,page
9200000128402143,Braun Silk-épil 5-610 Wit/Turquoise - Epilator,De Braun 5 epilators zorgenvoor een gladde huid tot wel 4 weken lang,Braun,https://www.kruidvat.nl/nl/nl/p/braun-silk-epil-5-610-wit-turquoise-epilator/9200000128402143/,"Zacht: Epilator perfect voor beginners, met een snelheidsinstelling voor extra zachte ontharing Precies:…","['Geschikt voor: Armen | Benen | Oksel | Intiem', 'Draadloos te gebruiken: Ja', 'Bruikbaar onder de douche: Bruikbaar onder de douche', 'Geintegreerd lampje: Nee']",66.39,,https://www.kruidvat.nl/,True,False,[],4.3,47,bol.com,P&G,NL,Search,10,https://www.bol.com/nl/nl/s/?searchtext=epilator,1
9200000106784581,Braun Silk-épil Beauty Set 9 9-995 Deluxe - Epileerapparaat - Scheerapparaat - Scrubben En Reiniging,De Braun 9 epilators zorgen voor een perfect gladde huid van top tot teen,Braun,https://www.kruidvat.nl/nl/nl/p/braun-silk-epil-beauty-set-9-9-995-deluxe-epileerapparaat-scheerapparaat-scrubben-en-reiniging/9200000106784581/,"De deluxe 9-in-1 beautyset voor ontharing van het gezicht en lichaam. Scrubben, epileren, scheren, trimmen,…","['Geschikt voor: Armen', 'Draadloos te gebruiken: Ja', 'Bruikbaar onder de douche: Bruikbaar onder de douche', 'Geintegreerd lampje: Nee']",143.99,,https://www.kruidvat.nl/,True,False,[],4.1,54,bol.com,P&G,NL,Search,11,https://www.bol.com/nl/nl/s/?searchtext=epilator,1
9300000009422197,Philips Series 8000 BRE710/00 - Wet & Dry - Epilator,Krachtig epileren | Tot wel 4 weken lang een gladde huid,Philips,https://www.kruidvat.nl/nl/nl/p/philips-series-8000-bre710-00-wet-dry-epilator/9300000009422197/,De Philips Epilator Series 8000 biedt krachtige maar zachte epilatie. Binnen slechts 10 minuten zijn…,"['Geschikt voor: Gezicht | Lichaam', 'Draadloos te gebruiken: Ja', 'Bruikbaar onder de douche: Bruikbaar onder de douche', 'Geintegreerd lampje: Ja']",63.99,,https://www.kruidvat.nl/,True,False,[],4.0,4,bol.com,P&G,NL,Search,12,https://www.bol.com/nl/nl/s/?searchtext=epilator,1
9000000010993637,"Braun Silk-épil 3 - Epileerapparaat - Wit, Roze",Het Smartlight onthult zelfs de kleinste haartjes zodat ze niet gemist worden,Braun,https://www.kruidvat.nl/nl/nl/p/braun-silk-epil-3-epileerapparaat-wit-roze/9000000010993637/,De epilator verwijdert 4x kortere haartjes in vergelijking met wax. De Braun Silk-épil 3 epilator verwijdert…,"['Geschikt voor: Armen', 'Draadloos te gebruiken: Nee', 'Geintegreerd lampje: Nee']",40.95,,https://www.kruidvat.nl/,True,False,[],3.9,98,bol.com,P&G,NL,Search,13,https://www.bol.com/nl/nl/s/?searchtext=epilator,1
9300000005684021,Philips Series 8000 BRE715/00 - Wet & Dry - Epilator,"Krachtig epileren, zacht voor de huid | Tot wel 4 weken lang een gladde huid",Philips,https://www.kruidvat.nl/nl/nl/p/philips-series-8000-bre715-00-wet-dry-epilator/9300000005684021/,De Philips Epilator Series 8000 biedt krachtige maar zachte epilatie. Binnen slechts 10 minuten zijn…,"['Geschikt voor: Benen', 'Draadloos te gebruiken: Ja', 'Bruikbaar onder de douche: Bruikbaar onder de douche', 'Geintegreerd lampje: Ja']",62.69,,https://www.kruidvat.nl/,True,False,[],3.7,33,bol.com,P&G,NL,Search,14,https://www.bol.com/nl/nl/s/?searchtext=epilator,1
9300000019977247,Shoplace ™ - 3 in 1 Epileerapparaat - Epileer Kit - Epilator -  Ladyshave - Scheerapparaat,,Shoplace,https://www.kruidvat.nl/nl/nl/p/shoplace-3-in-1-epileerapparaat-epileer-kit-epilator-ladyshave-scheerapparaat/9300000019977247/,"Ben jij het scheren en waxen zat, of heb jij last van ingegroeide haren en huidirritaties? Zoek niet…","['Geschikt voor: Wenkbrauw | Intiem | Benen | Armen | Gezicht | Oksel', 'Draadloos te gebruiken: Ja', 'Geintegreerd lampje: Ja']",44.95,,https://www.kruidvat.nl/,True,True,[],4.4,45,bol.com,P&G,NL,Search,15,https://www.bol.com/nl/nl/s/?searchtext=epilator,1
9300000045227829,Qeste | Epilator | Scheerapparaat | Scheerapparaat vrouwen | Epilator vrouwen | Ontharing | Laser | Dermatologisch goedgekeurd | Laser epilator | Scheren,,Qeste,https://www.kruidvat.nl/nl/nl/p/qeste-epilator-scheerapparaat-scheerapparaat-vrouwen-epilator-vrouwen-ontharing-laser-dermatologisch-goedgekeurd-laser-epilator-scheren/9300000045227829/,Snel en pijnloos scheren was nog nooit zo makkelijk! Met dit dermatologische goedgekeurde scheerapparaat/epilator…,"['Geschikt voor: Armen | Benen | Gezicht | Intiem | Oksel', 'Draadloos te gebruiken: Ja', 'Geintegreerd lampje: Ja']",29.95,,https://www.kruidvat.nl/,True,True,[],5.0,2,bol.com,P&G,NL,Search,16,https://www.bol.com/nl/nl/s/?searchtext=epilator,1
9200000110089298,Philips Satinelle Essential BRE235/00 - Epilator,Moeiteloos epileren | Wekenlang een gladde huid,Philips,https://www.kruidvat.nl/nl/nl/p/philips-satinelle-essential-bre235-00-epilator/9200000110089298/,"Geniet wekenlang van gladde benen met Philips Satinelle. Haren vanaf 0,5 mm worden voorzichtig vanaf…","['Geschikt voor: Benen | Oksel', 'Draadloos te gebruiken: Nee', 'Geintegreerd lampje: Nee']",29.49,,https://www.kruidvat.nl/,True,False,[],3.7,3,bol.com,P&G,NL,Search,17,https://www.bol.com/nl/nl/s/?searchtext=epilator,1
9200000128402103,Braun Silk-épil 5 5-820 Wit/Roze - Epilator + bikinistyler,De Braun 5 epilators zorgenvoor een gladde huid tot wel 4 weken lang,Braun,https://www.kruidvat.nl/nl/nl/p/braun-silk-epil-5-5-820-wit-roze-epilator-bikinistyler/9200000128402103/,"Zacht: Epilator perfect voor beginners, met een snelheidsinstelling voor extra zachte ontharing Grondig:…","['Geschikt voor: Armen | Benen | Oksel | Gezicht | Intiem', 'Draadloos te gebruiken: Ja', 'Bruikbaar onder de douche: Bruikbaar onder de douche', 'Geintegreerd lampje: Nee']",74.99,,https://www.kruidvat.nl/,True,False,[],4.1,24,bol.com,P&G,NL,Search,18,https://www.bol.com/nl/nl/s/?searchtext=epilator,1
9300000042473889,Elektrische epilator wenkbrauw inclusief ledlicht - Gezichtsepilator - Epilator - Epileerapparaat - Epilator gezicht - Epilady - Epileerapparaat dames - Wenkbrauwtrimmer - Wenkbrauw epilator - Wenkbrauw - Epileer - Epileren - Trimmer,,Innovagoods,https://www.kruidvat.nl/nl/nl/p/elektrische-epilator-wenkbrauw-inclusief-ledlicht-gezichtsepilator-epilator-epileerapparaat-epilator-gezicht-epilady-epileerapparaat-dames-wenkbrauwtrimmer-wenkbrauw-epilator-wenkbrauw-epileer-epileren-trimmer/9300000042473889/,Elektrische epilator wenkbrauw inclusief ledlicht Als vrouw heb je graag verzorgde wenkbrauwen met een…,"['Geschikt voor: Gezicht | Wenkbrauw', 'Draadloos te gebruiken: Ja', 'Geintegreerd lampje: Ja']",14.99,,https://www.kruidvat.nl/,True,False,[],5.0,1,bol.com,P&G,NL,Search,19,https://www.bol.com/nl/nl/s/?searchtext=epilator,1
9200000089674335,Braun FaceSpa Pro 912 Gezichtsepilator - Wit/Brons,Luxe gezichtsset inclusief microvibratie-verstevigingskop voor een zichtbaar verbeterde huiduitstraling,Braun,https://www.kruidvat.nl/nl/nl/p/braun-facespa-pro-912-gezichtsepilator-wit-brons/9200000089674335/,s WERELDS EERSTE: 's Werelds eerste apparaat voor gezichtsepilatie en -reiniging STRALENDE HUID: De combinatie…,"['Geschikt voor: Gezicht', 'Draadloos te gebruiken: Ja', 'Geintegreerd lampje: Nee']",109.99,,https://www.kruidvat.nl/,True,False,[],3.9,245,bol.com,P&G,NL,Search,20,https://www.bol.com/nl/nl/s/?searchtext=epilator,1
9200000087279271,Braun Silk-épil 5-500 - Epilator Voor Beginners - Wet & Dry Epileren,De Braun 5 epilators zorgenvoor een gladde huid tot wel 4 weken lang,Braun,https://www.kruidvat.nl/nl/nl/p/braun-silk-epil-5-500-epilator-voor-beginners-wet-dry-epileren/9200000087279271/,"ZACHT: Epilator voor vrouwen en ideaal voor beginners, biedt tot 100% zachte ontharing in slechts Ã©Ã©n…","['Geschikt voor: Armen', 'Draadloos te gebruiken: Ja', 'Bruikbaar onder de douche: Bruikbaar onder de douche', 'Geintegreerd lampje: Nee']",51.99,,https://www.kruidvat.nl/,True,False,[],4.2,20,bol.com,P&G,NL,Search,21,https://www.bol.com/nl/nl/s/?searchtext=epilator,1
9300000058765772,Ann Wenkbrauw Trimmer Pro - Effectieve Ontharing Epilator voor Wenkbrauwen - Gezichtsepilator Dames - Gold,,Ann,https://www.kruidvat.nl/nl/nl/p/ann-wenkbrauw-trimmer-pro-effectieve-ontharing-epilator-voor-wenkbrauwen-gezichtsepilator-dames-gold/9300000058765772/,"Heb je moeite om je wenkbrauwen te verzorgen en te repareren? We weten allemaal dat snijden, plukken…","['Geschikt voor: Gezicht', 'Draadloos te gebruiken: Ja', 'Bruikbaar onder de douche: Bruikbaar onder de douche', 'Geintegreerd lampje: Nee']",9.95,,https://www.kruidvat.nl/,True,False,[],5.0,1,bol.com,P&G,NL,Search,22,https://www.bol.com/nl/nl/s/?searchtext=epilator,1
9200000108371358,Braun FaceSpa PRO 910 2in1 Gezichtsepilator en Reinigingsborstel Wit,,Braun,https://www.kruidvat.nl/nl/nl/p/braun-facespa-pro-910-2in1-gezichtsepilator-en-reinigingsborstel-wit/9200000108371358/,"Braun FACESPA FaceSpa PRO 910 2in1 gezichtsepilator en reinigingsborstel, Verwijder gezichtshaar zacht…","['Geschikt voor: Gezicht', 'Draadloos te gebruiken: Ja', 'Bruikbaar onder de douche: Bruikbaar onder de douche']",84.95,,https://www.kruidvat.nl/,True,False,[],Er zijn nog geen beoordelingen voor dit product.,,bol.com,P&G,NL,Search,23,https://www.bol.com/nl/nl/s/?searchtext=epilator,1
9200000116675303,Braun Silk-épil 9 9/897 Roze Goud - Wet&Dry SensoSmart Epileerapparaat,De epilator bevat SensoSmart™ druksensortechnologie om je ontharing te begeleiden en in één beweging nog meer haar te verwijderen,Braun,https://www.kruidvat.nl/nl/nl/p/braun-silk-epil-9-9-897-roze-goud-wet-dry-sensosmart-epileerapparaat/9200000116675303/,De eerste slimme epilator ter wereld met de nieuwe SensoSmart technologie Begeleidt voor minder druk…,"['Geschikt voor: Armen', 'Draadloos te gebruiken: Ja', 'Bruikbaar onder de douche: Bruikbaar onder de douche', 'Geintegreerd lampje: Nee']",99.00,,https://www.kruidvat.nl/,True,False,[],4.1,54,bol.com,P&G,NL,Search,24,https://www.bol.com/nl/nl/s/?searchtext=epilator,1
9200000105388806,Philips Satinelle Essential BRE265/00 - Epileerapparaat,Moeiteloos epileren | Wekenlang een gladde huid,Philips,https://www.kruidvat.nl/nl/nl/p/philips-satinelle-essential-bre265-00-epileerapparaat/9200000105388806/,"Geniet wekenlang van gladde benen met Philips Satinelle. Haren vanaf 0,5 mm worden voorzichtig vanaf…","['Geschikt voor: Armen | Benen | Intiem | Oksel', 'Draadloos te gebruiken: Nee', 'Geintegreerd lampje: Ja']",37.99,,https://www.kruidvat.nl/,True,False,[],4.2,35,bol.com,P&G,NL,Search,25,https://www.bol.com/nl/nl/s/?searchtext=epilator,1
9200000108611128,Philips Satinelle Essential  BRE275/00 - Epilator,Moeiteloos epileren | Wekenlang een gladde huid,Philips,https://www.kruidvat.nl/nl/nl/p/philips-satinelle-essential-bre275-00-epilator/9200000108611128/,"Geniet wekenlang van gladde benen met Philips Satinelle. Haren vanaf 0,5 mm worden voorzichtig vanaf…","['Geschikt voor: Benen', 'Draadloos te gebruiken: Nee', 'Geintegreerd lampje: Ja']",39.99,,https://www.kruidvat.nl/,True,False,[],4.0,1,bol.com,P&G,NL,Search,26,https://www.bol.com/nl/nl/s/?searchtext=epilator,1
9200000087279197,"Braun Silk-épil 3-410 Epilator voor Langdurige Ontharing, Scheer- en Trimmerkop",Het Smartlight onthult zelfs de kleinste haartjes zodat ze niet gemist worden,Braun,https://www.kruidvat.nl/nl/nl/p/braun-silk-epil-3-410-epilator-voor-langdurige-ontharing-scheer-en-trimmerkop/9200000087279197/,De epilator verwijdert 4x kortere haartjes in vergelijking met wax. De Braun Silk-épil 3 epilator verwijdert…,"['Geschikt voor: Armen | Benen', 'Draadloos te gebruiken: Nee', 'Geintegreerd lampje: Nee']",43.03,,https://www.kruidvat.nl/,True,False,[],4.1,51,bol.com,P&G,NL,Search,27,https://www.bol.com/nl/nl/s/?searchtext=epilator,1
9200000106784579,Braun Silk-épil Beautyset 5 5-895 Epilator,De Braun 5 epilators zorgenvoor een gladde huid tot wel 4 weken lang,Braun,https://www.kruidvat.nl/nl/nl/p/braun-silk-epil-beautyset-5-5-895-epilator/9200000106784579/,"De 6-in-1 beautystarterset voor ontharing van het gezicht en lichaam. Epileren, scheren, trimmen, reinigen,…","['Geschikt voor: Armen | Benen | Oksel | Gezicht | Intiem', 'Draadloos te gebruiken: Ja', 'Bruikbaar onder de douche: Bruikbaar onder de douche', 'Geintegreerd lampje: Nee']",83.95,,https://www.kruidvat.nl/,True,False,[],4.4,21,bol.com,P&G,NL,Search,28,https://www.bol.com/nl/nl/s/?searchtext=epilator,1
9300000007754119,Philips Series 8000 BRE721/00 - Wet & Dry - Epilator,"Krachtig epileren, zacht voor de huid | Tot wel 4 weken lang een gladde huid",Philips,https://www.kruidvat.nl/nl/nl/p/philips-series-8000-bre721-00-wet-dry-epilator/9300000007754119/,De Philips Epilator Series 8000 biedt krachtige maar zachte epilatie. Binnen slechts 10 minuten zijn…,"['Geschikt voor: Benen', 'Draadloos te gebruiken: Ja', 'Bruikbaar onder de douche: Bruikbaar onder de douche', 'Geintegreerd lampje: Ja']",88.69,,https://www.kruidvat.nl/,True,True,[],3.7,33,bol.com,P&G,NL,Search,29,https://www.bol.com/nl/nl/s/?searchtext=epilator,1
9200000072389891,Gillette Gevoelige huid Scheerschuim Mannen - 6x250ml Voordeelverpakking,Het rijke schuim helpt de huid te beschermen tijdens het scheren,Gillette,https://www.kruidvat.nl/nl/nl/p/gillette-gevoelige-huid-scheerschuim-mannen-6x250ml-voordeelverpakking/9200000072389891/,Het Gillette Series Scheerschuim Gevoelige Huid beschermt en bezorgt je een gladde scheerbeurt Formule…,"['1500 ml', 'Huidtype: Gevoelige huid', 'Voor mannen']",14.95,"21,54",https://media.s-bol.com/Bx28M6ogVpn/168x167.jpg,True,False,['31%'],4.8,9,bol.com,P&G,NL,Search,1,https://www.bol.com/nl/nl/s/?searchtext=scheerschuim,1
9300000019067074,King C. Gillette Baard En Gezichtsreiniger Voor Mannen 350 ml,,King C. Gillette,https://www.kruidvat.nl/nl/nl/p/king-c-gillette-baard-en-gezichtsreiniger-voor-mannen-350-ml/9300000019067074/,"Het ultieme resultaat van meer dan een eeuw innovatie en expertise Beard and face wash die verfrist,…","['350 ml', 'Huidtype: Alle huidtypes', 'Voor mannen']",9.99,,https://www.kruidvat.nl/,True,False,[],4.5,6,bol.com,P&G,NL,Search,2,https://www.bol.com/nl/nl/s/?searchtext=scheerschuim,1
9200000072389885,Gillette Fusion5 ProGlide Cooling Scheergel Mannen - 6x200ml Voordeelverpakking,,Gillette,https://www.kruidvat.nl/nl/nl/p/gillette-fusion5-proglide-cooling-scheergel-mannen-6x200ml-voordeelverpakking/9200000072389885/,"Verzorgd, glad en comfortabel Geavanceerde glijtechnologie Hydrateert om haar te verzachten Helpt je…","['1200 ml', 'Huidtype: Alle huidtypes', 'Voor mannen']",23.76,"39,60",https://media.s-bol.com/gQ0lD95jOBmj/mQzKjR3/168x160.jpg,True,True,['40%'],5.0,30,bol.com,P&G,NL,Search,3,https://www.bol.com/nl/nl/s/?searchtext=scheerschuim,1
9300000003275849,"Serie Scheren Intieme zone - 3 producten voor het verwijderen van rode bultjes, Vlekjes en ingegroeide Haren Na het Scheren. De serie bevat: Intim Wash 200ml, Intim Shave 100ml, Intieme aftershave balsem 100ml | Australian Bodycare",,Australian Bodycare,https://www.kruidvat.nl/nl/nl/p/serie-scheren-intieme-zone-3-producten-voor-het-verwijderen-van-rode-bultjes-vlekjes-en-ingegroeide-haren-na-het-scheren-de-serie-bevat-intim-wash-200ml-intim-shave-100ml-intieme-aftershave-balsem-100ml-australian-bodycare/9300000003275849/,RESULTATEN: Wat kan ik verwachten en wanneer? Gebruik de 3 producten voor het scheren van de intieme…,"['100 ml', 'Huidtype: Geirriteerde huid', 'Voor unisex']",29.99,,https://www.kruidvat.nl/,True,True,[],4.0,4,bol.com,P&G,NL,Search,4,https://www.bol.com/nl/nl/s/?searchtext=scheerschuim,1
9200000072389879,Gillette Basic Gevoelige Huid Scheerschuim Mannen - 6x200ml Voordeelverpakking,,Gillette,https://www.kruidvat.nl/nl/nl/p/gillette-basic-gevoelige-huid-scheerschuim-mannen-6x200ml-voordeelverpakking/9200000072389879/,"Extra dik scheerschuim voor een gladde en comfortabele scheerbeurt Gewoon uitsmeren, moeiteloos scheren,…","['1200 ml', 'Huidtype: Alle huidtypes', 'Voor mannen']",14.50,,https://www.kruidvat.nl/,True,False,[],4.6,23,bol.com,P&G,NL,Search,5,https://www.bol.com/nl/nl/s/?searchtext=scheerschuim,1
9200000077341447,Proraso - Wood & Spice Beard Wash,,Proraso,https://www.kruidvat.nl/nl/nl/p/proraso-wood-spice-beard-wash/9200000077341447/,Proraso Wood & Spice Beard Wash 200ml…,"['100 ml', 'Huidtype: Droge huid', 'Voor mannen']",16.95,,https://www.kruidvat.nl/,True,False,[],5.0,2,bol.com,P&G,NL,Search,6,https://www.bol.com/nl/nl/s/?searchtext=scheerschuim,1
9200000058997143,Gentl man intieme verzorging - 50 ml,,gentl man,https://www.kruidvat.nl/nl/nl/p/gentl-man-intieme-verzorging-50-ml/9200000058997143/,VOOR MANNEN MET BALLEN Eindelijk is er een creme voor na het ontharen van de schaamstreek voor Mannen.…,"['50 ml', 'Huidtype: Geirriteerde huid', 'Voor mannen']",15.55,,https://www.kruidvat.nl/,True,False,[],4.2,14,bol.com,P&G,NL,Search,7,https://www.bol.com/nl/nl/s/?searchtext=scheerschuim,1
9200000038761121,NIVEA MEN Sensitive Cooling Scheerschuim - 200 ml,,NIVEA,https://www.kruidvat.nl/nl/nl/p/nivea-men-sensitive-cooling-scheerschuim-200-ml/9200000038761121/,NIVEA MEN Sensitive Cooling Scheerschuim beschermt de huid tegen irritaties en voorkomt een branderig…,"['200 ml', 'Huidtype: Gevoelige huid', 'Voor mannen']",6.79,,https://www.kruidvat.nl/,True,False,[],4.3,11,bol.com,P&G,NL,Search,8,https://www.bol.com/nl/nl/s/?searchtext=scheerschuim,1
9200000104263008,De Vergulde Hand - Scheerschuim - Voordeelverpakking - 3 x 200 ml,,Vergulde Hand,https://www.kruidvat.nl/nl/nl/p/de-vergulde-hand-scheerschuim-voordeelverpakking-3-x-200-ml/9200000104263008/,De Vergulde Hand - Scheerschuim - 3 x 200 ml Voordeelverpakking De Vergulde Hand Scheerschuim heeft een…,"['120 ml', 'Huidtype: Gevoelige huid', 'Voor mannen']",14.99,,https://www.kruidvat.nl/,True,False,[],4.8,8,bol.com,P&G,NL,Search,9,https://www.bol.com/nl/nl/s/?searchtext=scheerschuim,1
9200000032885412,Biotherm Homme - Sensitive Skin Shaving Foam 200 ml. /Skin Care,,Biotherm,https://www.kruidvat.nl/nl/nl/p/biotherm-homme-sensitive-skin-shaving-foam-200-ml-skin-care/9200000032885412/,BIOTHERM - HOMME Foam Shaver - Shaving Foam - 200ml…,"['200 ml', 'Huidtype: Gevoelige huid', 'Voor mannen']",23.40,,https://www.kruidvat.nl/,True,False,[],5.0,2,bol.com,P&G,NL,Search,10,https://www.bol.com/nl/nl/s/?searchtext=scheerschuim,1
9200000091135670,Vergulde Hand Scheerschuim  - Voordeelverpakking 6 x 250 ml,,Vergulde Hand,https://www.kruidvat.nl/nl/nl/p/vergulde-hand-scheerschuim-voordeelverpakking-6-x-250-ml/9200000091135670/,De Vergulde Hand is al meer dan 460 jaar de autoriteit op gebied van authentiek nat scheren. De Vergulde…,"['1500 ml', 'Huidtype: Alle huidtypes', 'Voor mannen']",19.99,,https://www.kruidvat.nl/,True,False,[],5.0,3,bol.com,P&G,NL,Search,11,https://www.bol.com/nl/nl/s/?searchtext=scheerschuim,1
9200000035434576,Proraso scheerschuim 300 ml,,Proraso,https://www.kruidvat.nl/nl/nl/p/proraso-scheerschuim-300-ml/9200000035434576/,Scheerschuim met eucalyptus en menthol dat elk baardtype verfrist!…,"['300 ml', 'Huidtype: Alle huidtypes', 'Voor mannen']",9.80,,https://www.kruidvat.nl/,True,False,[],3.7,3,bol.com,P&G,NL,Search,12,https://www.bol.com/nl/nl/s/?searchtext=scheerschuim,1
9200000087323810,NIVEA Sensitive Scheerschuim 200 ml,,NIVEA,https://www.kruidvat.nl/nl/nl/p/nivea-sensitive-scheerschuim-200-ml/9200000087323810/,"NIVEA MEN Sensitive Rasierschaum. Geschikt voor huidtypes: Gevoelige huid, Geschikt voor: Mannen, Inhoud:…","['200 ml', 'Huidtype: Gevoelige huid', 'Voor mannen']",8.25,"10,59",https://www.kruidvat.nl/,True,False,['22%'],4.5,13,bol.com,P&G,NL,Search,13,https://www.bol.com/nl/nl/s/?searchtext=scheerschuim,1
9200000048079809,Proraso Scheerschuim Groen 300 ml.,,Proraso,https://www.kruidvat.nl/nl/nl/p/proraso-scheerschuim-groen-300-ml/9200000048079809/,Proraso Scheerschuim Groen is gemaakt van natuurlijke stearine met natuurlijke ingrediënten voor een…,"['400 ml', 'Huidtype: Alle huidtypes', 'Voor mannen']",10.29,,https://www.kruidvat.nl/,True,False,[],4.9,11,bol.com,P&G,NL,Search,14,https://www.bol.com/nl/nl/s/?searchtext=scheerschuim,1
9300000024729844,Gillette Venus Embrace sensitive scheersysteem ( incl 1 mesje)  met satin care scheergel 200ml - spuitbus,,Gillette,https://www.kruidvat.nl/nl/nl/p/gillette-venus-embrace-sensitive-scheersysteem-met-satin-care-scheergel-200ml-spuitbus/9300000024729844/,Het Gillette Venus Embrace Sensitive Scheermes voor dames heeft 5 mesjes en een beschermende vochtstrip…,"['200 ml', 'Huidtype: Alle huidtypes', 'Voor vrouwen']",26.50,,https://www.kruidvat.nl/,True,True,[],Er zijn nog geen beoordelingen voor dit product.,,bol.com,P&G,NL,Search,15,https://www.bol.com/nl/nl/s/?searchtext=scheerschuim,1
9300000043053440,Porn Pussy - Scheerschuim Voor Vrouwen,,Porn Pussy,https://www.kruidvat.nl/nl/nl/p/porn-pussy-scheerschuim-voor-vrouwen/9300000043053440/,Porn Pussy scheerschuim is ontwikkeld voor de gevoelige delen van het lichaam en zorgt voor een minder…,[],14.95,,https://www.kruidvat.nl/,True,True,[],Er zijn nog geen beoordelingen voor dit product.,,bol.com,P&G,NL,Search,16,https://www.bol.com/nl/nl/s/?searchtext=scheerschuim,1
9200000089448356,De Vergulde Hand Scheerschuim 250ml BE6,,Vergulde Hand,https://www.kruidvat.nl/nl/nl/p/de-vergulde-hand-scheerschuim-250ml-be6/9200000089448356/,Vergulde Hand Scheerschuim Het scheerschuim van De Vergulde Hand heeft een drievoudige werking voor een…,"['250 ml', 'Huidtype: Alle huidtypes', 'Voor mannen']",8.02,,https://www.kruidvat.nl/,True,False,[],Er zijn nog geen beoordelingen voor dit product.,,bol.com,P&G,NL,Search,17,https://www.bol.com/nl/nl/s/?searchtext=scheerschuim,1
9200000089448358,De Vergulde Hand Scheerschuim 50ml,,Vergulde Hand,https://www.kruidvat.nl/nl/nl/p/de-vergulde-hand-scheerschuim-50ml/9200000089448358/,"Het scheerschuim van De Vergulde Hand heeft een verzachtende, beschermende en voedende werking op de…","['50 ml', 'Huidtype: Alle huidtypes', 'Voor mannen']",6.99,,https://www.kruidvat.nl/,True,False,[],Er zijn nog geen beoordelingen voor dit product.,,bol.com,P&G,NL,Search,18,https://www.bol.com/nl/nl/s/?searchtext=scheerschuim,1
9300000024203441,NIVEA MEN Cool Kick Scheerschuim - 6 x 200 ml - voordeelverpakking,Voor een comfortabele scheerbeurt en een super fris gevoel,NIVEA,https://www.kruidvat.nl/nl/nl/p/nivea-men-cool-kick-scheerschuim-6-x-200-ml-voordeelverpakking/9300000024203441/,NIVEA MEN FRESH KICK SCHEERSCHUIM met munt extract en cactus water zorgt voor een onmiddellijke verfrissing…,"['400 ml', 'Huidtype: Alle huidtypes', 'Voor mannen']",23.19,"25,74",https://www.kruidvat.nl/,True,False,['10%'],5.0,1,bol.com,P&G,NL,Search,19,https://www.bol.com/nl/nl/s/?searchtext=scheerschuim,1
9300000018351602,Pakket 3x Gillette   scheerschuim 200ml  voor de gevoelige huid,,Gillette,https://www.kruidvat.nl/nl/nl/p/pakket-3x-gillette-scheerschuim-200ml-voor-de-gevoelige-huid/9300000018351602/,Pakket van 3x Gillette Scheerschuim 200ml zachte mousse voor de gevoelige huid…,"['600 ml', 'Huidtype: Gevoelige huid', 'Voor unisex']",11.99,,https://www.kruidvat.nl/,True,False,[],Er zijn nog geen beoordelingen voor dit product.,,bol.com,P&G,NL,Search,20,https://www.bol.com/nl/nl/s/?searchtext=scheerschuim,1
9200000084790489,Gillette Series Sensitive scheergel 100 ml Mannen,,Gillette,https://www.kruidvat.nl/nl/nl/p/gillette-series-sensitive-scheergel-100-ml-mannen/9200000084790489/,"Gillette scheerschuim met extra bescherming, speciaal ontwikkeld voor de gevoelige huid…","['100 ml', 'Huidtype: Gevoelige huid', 'Voor unisex']",9.00,,https://www.kruidvat.nl/,True,False,[],5.0,1,bol.com,P&G,NL,Search,21,https://www.bol.com/nl/nl/s/?searchtext=scheerschuim,1
9200000078957756,Gillette Basic Scheerschuim Regular Voordeelverpakking,,Gillette,https://www.kruidvat.nl/nl/nl/p/gillette-basic-scheerschuim-regular-voordeelverpakking/9200000078957756/,Gillette Basic Scheerschuim Regular - Extra Grote Bus 300ml Met Gillette Basic Scheerschuim Regular voor…,"['1800 ml', 'Voor mannen']",20.99,,https://www.kruidvat.nl/,True,False,[],Er zijn nog geen beoordelingen voor dit product.,,bol.com,P&G,NL,Search,22,https://www.bol.com/nl/nl/s/?searchtext=scheerschuim,1
9300000004768636,Gillette Basic Scheerschuim Regular XL - Voordeelverpakking 6 x 300 ml,,Gillette,https://www.kruidvat.nl/nl/nl/p/gillette-basic-scheerschuim-regular-xl-voordeelverpakking-6-x-300-ml/9300000004768636/,Gillette Basic Scheerschuim Regular - Extra Grote Bus 300ml Met Gillette Basic Scheerschuim Regular voor…,"['1800 ml', 'Huidtype: Normale huid', 'Voor mannen']",19.99,,https://www.kruidvat.nl/,True,False,[],Er zijn nog geen beoordelingen voor dit product.,,bol.com,P&G,NL,Search,23,https://www.bol.com/nl/nl/s/?searchtext=scheerschuim,1
9200000083471004,Kaerel Scheercreme - Mild en Krachtig - Natuurlijke ingredienten - 100 ml,Bevat geen parabenen of synthetische conserveringsmiddelen.,Kaerel,https://www.kruidvat.nl/nl/nl/p/kaerel-scheercreme-mild-en-krachtig-natuurlijke-ingredienten-100-ml/9200000083471004/,"SMOOTH OPERATOR Natuurlijke scheercrème voor ultragladde huid, gebruik met of zonder water. Schuimt niet.…","['00 ml', 'Huidtype: Alle huidtypes', 'Voor mannen']",13.83,,https://www.kruidvat.nl/,True,False,[],Er zijn nog geen beoordelingen voor dit product.,,bol.com,P&G,NL,Search,24,https://www.bol.com/nl/nl/s/?searchtext=scheerschuim,1
9200000077341437,Proraso - Cypress & Vetyver Beard Wash 200ml,,Proraso,https://www.kruidvat.nl/nl/nl/p/proraso-cypress-vetyver-beard-wash-200ml/9200000077341437/,Proraso Beard Wash Cypress & Vetyver reinigt de baard en onderliggende huid en zorgt voor een frisse…,"['200 ml', 'Huidtype: Alle huidtypes', 'Voor mannen']",15.75,,https://www.kruidvat.nl/,True,False,[],5.0,1,bol.com,P&G,NL,Search,25,https://www.bol.com/nl/nl/s/?searchtext=scheerschuim,1
