sku,title,sub_title,brand,product_url,description,product_specification,price,old_price,image,in_stock,is_sponsored,discount_value,rating,reviews,e_retailer,client,market,type,position,listing_url,page
9300000048091198,Braun Series X - XT5200 Hybride Trimmer,"De Braun Series XT5 is een baardtrimmer, lichaamsverzorger en elektrisch scheermes in één",Braun,https://www.kruidvat.nl/nl/nl/p/braun-series-x-xt5200-hybride-trimmer/9300000048091198/,"Scheren, trimmen en randen bijwerken met één enkel apparaat: alles-in-één scheerapparaat en baardtrimmer.…","['Meegeleverd: Beschermkap | Reinigingsborsteltje | Baardtrimmer', 'Type baardgroei: Licht | Middel', 'Snel laden functie', '45 minuten draadloos te gebruiken', 'Lengte-instelling: 1 tot 1 mm', 'Afspoelbaar', 'geschikt voor nat scheren']",58.99,,https://www.kruidvat.nl/,True,False,[],4.3,15,bol.com,P&G,NL,Search,27,https://www.bol.com/nl/nl/s/?searchtext=trimmer,1
9200000130666431,Braun BT7240 - Baardtrimmer,,Braun,https://www.kruidvat.nl/nl/nl/p/braun-bt7240-baardtrimmer/9200000130666431/,Creëer in alle gemak je eigen stijl met de Braun BT7240 baardtrimmer en haartrimmer voor mannen. De BT7240…,"['Meegeleverd: Baardtrimmer | Opzetkam', 'Type baardgroei: Middel', '100 minuten draadloos te gebruiken', 'Lengte-instelling: 5 tot 200 mm', 'Afspoelbaar']",52.29,,https://www.kruidvat.nl/,True,False,[],4.3,67,bol.com,P&G,NL,Search,28,https://www.bol.com/nl/nl/s/?searchtext=trimmer,1
9300000012899422,Daroyx® professionele trimmer mannen - baardtrimmer -  model Dragon Fire,,Daroyx,https://www.kruidvat.nl/nl/nl/p/daroyx-professionele-trimmer-mannen-baardtrimmer-model-dragon-fire/9300000012899422/,"Daroyx® Dragon Fire is zowel een (baard) trimmer als tondeuse in één. Super makkelijk in gebruik, de…","['Lengte-instelling: 0 tot 0 mm', 'Draadloos te gebruiken: Ja']",39.95,,https://www.kruidvat.nl/,True,True,[],5.0,1,bol.com,P&G,NL,Search,29,https://www.bol.com/nl/nl/s/?searchtext=trimmer,1
9300000005466505,BAESS 5 in 1 Baardtrimmer voor mannen - Trimmer voor Baard en Lichaam - Neus en Oor -  0.5-20MM - Tondeuse Mannen - Blauw,Heeft een duurzame batterij,BAESS,https://www.kruidvat.nl/nl/nl/p/baess-5-in-1-baardtrimmer-voor-mannen-trimmer-voor-baard-en-lichaam-neus-en-oor-0-5-20mm-tondeuse-mannen-blauw/9300000005466505/,Ben je op zoek naar een veilige en multifunctionele baardtrimmer waarmee je het gehele gezicht en lichaam…,"['Meegeleverd: Accu | Baardtrimmer | Extra scheeropzetstuk | Kam | USB lader', 'Type baardgroei: Licht | Middel | Zwaar', '65 minuten draadloos te gebruiken', 'Lengte-instelling: 1 tot 1 mm', 'Afspoelbaar', 'geschikt voor nat scheren', 'Zelfslijpende messen']",42.95,,https://www.kruidvat.nl/,True,True,[],4.5,49,bol.com,P&G,NL,Search,30,https://www.bol.com/nl/nl/s/?searchtext=trimmer,1
9200000095000966,Oral-B Pro 2 2500 - Zwart - Elektrische Tandenborstel,Met 2 minuten-timer en batterij die meer dan 2 weken meegaat | 2 poetsstanden: dagelijkse reiniging en tandvleesverzorging,Oral B,https://www.kruidvat.nl/nl/nl/p/oral-b-pro-2-2500-zwart-elektrische-tandenborstel/9200000095000966/,Tot 100% meer tandplakverwijdering: ronde kop reinigt beter voor gezonder tandvlees in 30 dagen in vergelijking…,"['Geschikt voor: Volwassenen', 'Inclusief timer: Ja', '3D: roterend en vibrerend', 'Ja, met licht- en trilsensor', 'Batterij-indicator', 'Oplader: Oplaadstation']",43.99,,https://media.s-bol.com/39JvjpkpGrv4/168x173.jpg,True,False,[],4.6,632,bol.com,P&G,NL,Search,1,https://www.bol.com/nl/nl/s/?searchtext=elektrische+tandenborstel,1
9200000117664163,Oral-B PRO 2 2900 - Elektrische Tandenborstel - Duopack,2 weken batterijduur|  2 poetstanden| poetstimer en zichtbare poetsdruksensor,Oral B,https://www.kruidvat.nl/nl/nl/p/oral-b-pro-2-2900-elektrische-tandenborstel-duopack/9200000117664163/,Tot 100% meer tandplakverwijdering: ronde kop reinigt beter voor gezonder tandvlees in 30 dagen in vergelijking…,"['Geschikt voor: Volwassenen', 'Inclusief timer: Ja', '3D: roterend en vibrerend', 'Ja, met licht- en trilsensor', 'Batterij-indicator', 'Oplader: Oplaadstation']",68.62,,https://www.kruidvat.nl/,True,False,[],4.6,151,bol.com,P&G,NL,Search,2,https://www.bol.com/nl/nl/s/?searchtext=elektrische+tandenborstel,1
9300000042907326,Luvion 250S - Sonische Elektrische Tandenborstel voor Baby en Peuter - 0 t/m 3 Jaar - Met Timer,,Luvion,https://www.kruidvat.nl/nl/nl/p/luvion-250s-sonische-elektrische-tandenborstel-voor-baby-en-peuter-0-t-m-3-jaar-met-timer/9300000042907326/,- NIEUW! - INTRODUCTIEAANBIEDING - Net zo poetsen als papa en mama! Onze sonische elektrische tandenborstel…,"['Geschikt voor: Baby', 'Inclusief timer: Ja', 'Sonisch: vibrerend', 'Nee', 'Oplader: Op batterijen']",27.95,"39,95",https://media.s-bol.com/gxBvxN8xAmnk/pgmABnV/168x205.jpg,True,True,['30%'],4.5,51,bol.com,P&G,NL,Search,3,https://www.bol.com/nl/nl/s/?searchtext=elektrische+tandenborstel,1
9300000043847525,Philips Sonicare Series 3100 HX3675/13 - Elektrische tandenborstel - Wit - Duopack,Vergeet jouw handtandenborstel. Poets met sonische technologie. | Tot 3 keer betere tandplakverwijdering,Philips,https://www.kruidvat.nl/nl/nl/p/philips-sonicare-series-3100-hx3675-13-elektrische-tandenborstel-wit-duopack/9300000043847525/,In combinatie met de Sonische technologie en de werking van de opzetborstels verwijdert de Philips Sonicare…,"['Geschikt voor: Volwassenen', 'Inclusief timer: Ja', 'Sonisch: vibrerend', 'Ja, met trilsensor', 'Batterij-indicator', 'Oplader: Oplaadstation']",55.99,,https://www.kruidvat.nl/,True,True,[],4.6,24,bol.com,P&G,NL,Search,4,https://www.bol.com/nl/nl/s/?searchtext=elektrische+tandenborstel,1
9200000095609041,Oral-B Vitality 100 CrossAction - Elektrische Tandenborstel - Zwart,Met 2 minuten timer,Oral,https://www.kruidvat.nl/nl/nl/p/oral-b-vitality-100-crossaction-elektrische-tandenborstel-zwart/9200000095609041/,De essentiële tandenborstel voor dagelijkse reiniging Verwijdert meer tandplak dan een gewone manuele…,"['Geschikt voor: Volwassenen', 'Inclusief timer: Ja', '2D: roterend', 'Nee', 'Oplader: Oplaadstation']",34.00,,https://www.kruidvat.nl/,True,False,[],4.4,1098,bol.com,P&G,NL,Search,5,https://www.bol.com/nl/nl/s/?searchtext=elektrische+tandenborstel,1
9300000035682974,Oral-B Pro 3 - 3000 - Zwarte - Elektrische Tandenborstel,Met verbeterde 360° poetsdrukcontrole | 2+ weken batterijduur | 3 poetstanden,Oral B,https://www.kruidvat.nl/nl/nl/p/oral-b-pro-3-3000-zwarte-elektrische-tandenborstel/9300000035682974/,Grondige reiniging en gezonder tandvlees met 360 is tandvleesdrukcontrole die u waarschuwt als u te hard…,"['Geschikt voor: Volwassenen', 'Inclusief timer: Ja', '3D: roterend en vibrerend', 'Ja, met licht- en trilsensor', 'Batterij-indicator', 'Oplader: Oplaadstation']",48.49,,https://www.kruidvat.nl/,True,False,[],4.2,67,bol.com,P&G,NL,Search,6,https://www.bol.com/nl/nl/s/?searchtext=elektrische+tandenborstel,1
9200000103033977,Oral-B Vitality 100 CrossAction - Blauw - Elektrische Tandenborstel,Met 2 minuten timer,Oral,https://www.kruidvat.nl/nl/nl/p/oral-b-vitality-100-crossaction-blauw-elektrische-tandenborstel/9200000103033977/,De essentiële tandenborstel voor dagelijkse reiniging Verwijdert meer tandplak dan een gewone manuele…,"['Geschikt voor: Volwassenen', 'Inclusief timer: Ja', '2D: roterend', 'Nee', 'Consumentenbond Beste koop - April 2020 | Consumentenbond Beste koop - December 2018', 'Oplader: Oplaadstation']",33.99,,https://www.kruidvat.nl/,True,False,[],4.4,1104,bol.com,P&G,NL,Search,7,https://www.bol.com/nl/nl/s/?searchtext=elektrische+tandenborstel,1
9300000035683492,Oral-B Pro 3 - 3900 - Zwarte en Roze - Elektrische Tandenborstel,Met verbeterde 360° poetsdrukcontrole | 2+ weken batterijduur | 3 poetstanden,Oral B,https://www.kruidvat.nl/nl/nl/p/oral-b-pro-3-3900-zwarte-en-roze-elektrische-tandenborstel/9300000035683492/,Grondige reiniging en gezonder tandvlees met 360 ̊ tandvleesdrukcontrole die u waarschuwt als u te hard…,"['Geschikt voor: Volwassenen', 'Inclusief timer: Ja', '3D: roterend en vibrerend', 'Ja, met licht- en trilsensor', 'Batterij-indicator', 'Oplader: Oplaadstation']",82.99,,https://www.kruidvat.nl/,True,False,[],4.2,67,bol.com,P&G,NL,Search,8,https://www.bol.com/nl/nl/s/?searchtext=elektrische+tandenborstel,1
9200000087326429,Philips Sonicare 2 series HX6232/20 Special Edition - Elektrische tandenborstel - Zwart,Verwijdert tot 7 keer meer tandplak vergeleken met een gewone tandenborstel,Philips,https://www.kruidvat.nl/nl/nl/p/philips-sonicare-2-series-hx6232-20-special-edition-elektrische-tandenborstel-zwart/9200000087326429/,Met de Philips Sonicare HX6232/20 elektrische tandenborstel verwijder je tot 7 keer meer tandplak vergeleken…,"['Geschikt voor: Volwassenen', 'Inclusief timer: Ja', 'Sonisch: vibrerend', 'Nee', 'Batterij-indicator', 'Oplader: Oplaadstation']",40.75,,https://www.kruidvat.nl/,True,False,[],4.4,94,bol.com,P&G,NL,Search,9,https://www.bol.com/nl/nl/s/?searchtext=elektrische+tandenborstel,1
9200000080184699,Oral_B Pro 2 - 2900 - Duoverpakking Elektrische Tandenborstel - Zwart,2 weken batterijduur|  2 poetstanden| poetstimer en zichtbare poetsdruksensor,Oral B,https://www.kruidvat.nl/nl/nl/p/oral-b-pro-2-2900-duoverpakking-elektrische-tandenborstel-zwart/9200000080184699/,Tot 100% meer tandplakverwijdering: ronde kop reinigt beter voor gezonder tandvlees in 30 dagen in vergelijking…,"['Geschikt voor: Volwassenen', 'Inclusief timer: Ja', '3D: roterend en vibrerend', 'Ja, met licht- en trilsensor', 'Batterij-indicator', 'Oplader: Oplaadstation']",67.89,,https://www.kruidvat.nl/,True,False,[],4.7,173,bol.com,P&G,NL,Search,10,https://www.bol.com/nl/nl/s/?searchtext=elektrische+tandenborstel,1
9200000081425384,Oral-B PRO 2 2950N - Elektrische Tandenborstel - Duopack - Zwart en Roze,2 weken batterijduur| 2 poetstanden| poetstimer en zichtbare poetsdruksensor,Oral B,https://www.kruidvat.nl/nl/nl/p/oral-b-pro-2-2950n-elektrische-tandenborstel-duopack-zwart-en-roze/9200000081425384/,Tot 100% meer tandplakverwijdering: ronde kop reinigt beter voor gezonder tandvlees in 30 dagen in vergelijking…,"['Geschikt voor: Volwassenen', 'Inclusief timer: Ja', '3D: roterend en vibrerend', 'Ja, met licht- en trilsensor', 'Batterij-indicator', 'Oplader: Oplaadstation']",58.99,,https://www.kruidvat.nl/,True,False,[],4.7,247,bol.com,P&G,NL,Search,11,https://www.bol.com/nl/nl/s/?searchtext=elektrische+tandenborstel,1
9300000004662522,Oral-B iO 8n - Elektrische Tandenborstel - Zwart,Nieuwste Oral-B elektrische tandenborstel met revolutionaire magnetische technologie Powered By Braun,Oral B,https://www.kruidvat.nl/nl/nl/p/oral-b-io-8n-elektrische-tandenborstel-zwart/9300000004662522/,De beste reiniging ooit van Oral-B met revolutionaire magnetische iO technologie voor een professioneel…,"['Geschikt voor: Volwassenen', 'Inclusief timer: Ja', '3D magnetisch: roterend, vibrerend en pulserend', 'Ja, met licht- en trilsensor', 'Batterij-indicator', 'Consumentenbond Beste uit de test - December 2020', 'Oplader: Oplaadstation']",179.85,,https://www.kruidvat.nl/,True,False,[],4.6,110,bol.com,P&G,NL,Search,12,https://www.bol.com/nl/nl/s/?searchtext=elektrische+tandenborstel,1
9300000005081673,Philips Sonicare For Kids HX6352/42 - Elektrische tandenborstel - roze,"Interactief sonisch vermogen. Meer plezier, beter poetsen",Philips,https://www.kruidvat.nl/nl/nl/p/philips-sonicare-for-kids-hx6352-42-elektrische-tandenborstel-roze/9300000005081673/,Houd de aandacht van uw kinderen erbij terwijl ze leren poetsen. De Philips Sonicare For Kids-tandenborstel…,"['Geschikt voor: Kinderen', 'Inclusief timer: Ja', 'Sonisch: vibrerend', 'Nee', 'Batterij-indicator', 'Oplader: Oplaadstation']",39.89,,https://www.kruidvat.nl/,True,False,[],4.6,141,bol.com,P&G,NL,Search,13,https://www.bol.com/nl/nl/s/?searchtext=elektrische+tandenborstel,1
9300000035683346,Oral-B Genius X - Wit - Elektrische Tandenborstel - Ontworpen Door Braun - 1 Handvat en 1 opzetborstel,Meer dan 2+ weken batterijduur | 6 poetstanden | Aangedreven door artificial intelligence,Oral B,https://www.kruidvat.nl/nl/nl/p/oral-b-genius-x-wit-elektrische-tandenborstel-ontworpen-door-braun-1-handvat-en-1-opzetborstel/9300000035683346/,Professioneel schoon en gezonder tandvlees dankzij Artificial Intelligence die uw poetsstijl onmiddellijk…,"['Geschikt voor: Volwassenen', 'Inclusief timer: Ja', '3D: roterend en vibrerend', 'Ja, met licht- en trilsensor', 'Batterij-indicator', 'Oplader: Oplaadstation']",104.99,,https://www.kruidvat.nl/,True,False,[],4.6,123,bol.com,P&G,NL,Search,14,https://www.bol.com/nl/nl/s/?searchtext=elektrische+tandenborstel,1
9300000043847505,Philips Sonicare Series 3100 HX3671/13 - Elektrische tandenborstel,Vergeet je handtandenborstel. Poets met sonische technologie | Tot 3 keer betere tandplakverwijdering,Philips,https://www.kruidvat.nl/nl/nl/p/philips-sonicare-series-3100-hx3671-13-elektrische-tandenborstel/9300000043847505/,De sonische technologie van de Philips Sonicare ProtectiveClean 3100 series HX3671/13 - Elektrische tandenborstel…,"['Geschikt voor: Volwassenen', 'Inclusief timer: Ja', 'Sonisch: vibrerend', 'Ja, met trilsensor', 'Batterij-indicator', 'Oplader: USB-lader']",39.99,,https://www.kruidvat.nl/,True,True,[],4.6,29,bol.com,P&G,NL,Search,15,https://www.bol.com/nl/nl/s/?searchtext=elektrische+tandenborstel,1
9200000102202912,Philips Sonicare ProtectiveClean 4500 Series HX6830/35 - Elektrische tandenborstel - Roze & Zwart,Wittere tanden. Zachte reiniging. | Wittere tanden in slechts 1 week,Philips,https://www.kruidvat.nl/nl/nl/p/philips-sonicare-protectiveclean-4500-series-hx6830-35-elektrische-tandenborstel-roze-zwart/9200000102202912/,Voel het verschil van de zachte reiniging met onze poetsdruksensor terwijl jouw tanden witter worden…,"['Geschikt voor: Volwassenen', 'Inclusief timer: Ja', 'Sonisch: vibrerend', 'Ja, met trilsensor', 'Batterij-indicator', 'Oplader: Oplaadstation']",138.48,,https://www.kruidvat.nl/,True,True,[],Er zijn nog geen beoordelingen voor dit product.,,bol.com,P&G,NL,Search,16,https://www.bol.com/nl/nl/s/?searchtext=elektrische+tandenborstel,1
9200000095000924,Oral-B Vitality 100 CrossAction - Elektrische Tandenborstel -1 Opzetborstel - Wit,Met twee minuten timer,Oral,https://www.kruidvat.nl/nl/nl/p/oral-b-vitality-100-crossaction-elektrische-tandenborstel-1-opzetborstel-wit/9200000095000924/,Verwijdert meer tandplak dan een gewone manuele tandenborstel Trilt iedere 30 seconden om u te laten…,"['Geschikt voor: Volwassenen', 'Inclusief timer: Ja', '2D: roterend', 'Nee', 'Consumentenbond Beste koop - April 2020 | Consumentenbond Beste koop - December 2018', 'Oplader: Oplaadstation']",27.00,,https://www.kruidvat.nl/,True,False,[],4.4,1104,bol.com,P&G,NL,Search,17,https://www.bol.com/nl/nl/s/?searchtext=elektrische+tandenborstel,1
9200000055111100,Philips Sonicare for kids HX6321/03 - Elektrische Tandenborstel - Blauw,Ingebouwde bluetooth voor de coaching app | kindertandenborstel,Philips,https://www.kruidvat.nl/nl/nl/p/philips-sonicare-for-kids-hx6321-03-elektrische-tandenborstel-blauw/9200000055111100/,Houd de aandacht van jouw kinderen erbij terwijl ze leren poetsen. De Philips Sonicare For Kids-tandenborstel…,"['Geschikt voor: Kinderen', 'Inclusief timer: Ja', 'Sonisch: vibrerend', 'Nee', 'Batterij-indicator', 'Kieskeurig.nl Best Reviewed - Juli 2016 | Kieskeurig.nl Best Reviewed - Augustus 2016', 'Oplader: Oplaadstation']",39.95,,https://www.kruidvat.nl/,True,False,[],4.6,141,bol.com,P&G,NL,Search,18,https://www.bol.com/nl/nl/s/?searchtext=elektrische+tandenborstel,1
9300000039017301,Oral-B Pro 3 3770 - Elektrische Tandenborstel - Blauw,Met verbeterde 360° poetsdrukcontrole | 2+ weken batterijduur | 3 poetstanden,Oral B,https://www.kruidvat.nl/nl/nl/p/oral-b-pro-3-3770-elektrische-tandenborstel-blauw/9300000039017301/,Grondige reiniging en gezonder tandvlees met 360 is tandvleesdrukcontrole die u waarschuwt als u te hard…,"['Geschikt voor: Volwassenen', 'Inclusief timer: Ja', '3D: roterend en vibrerend', 'Ja, met licht- en trilsensor', 'Batterij-indicator', 'Oplader: Oplaadstation']",52.99,,https://www.kruidvat.nl/,True,False,[],4.2,67,bol.com,P&G,NL,Search,19,https://www.bol.com/nl/nl/s/?searchtext=elektrische+tandenborstel,1
9200000078085272,Oral-B Pro 2 2000N CrossAction - Elektrische tandenborstel - Blauw,Beschikt over een professionele 2 minuten-timer en oplichtende poetsdruksensor,Oral B,https://www.kruidvat.nl/nl/nl/p/oral-b-pro-2-2000n-crossaction-elektrische-tandenborstel-blauw/9200000078085272/,Tot 100% meer tandplakverwijdering: ronde kop reinigt beter voor gezonder tandvlees in 30 dagen in vergelijking…,"['Geschikt voor: Volwassenen', 'Inclusief timer: Ja', '3D: roterend en vibrerend', 'Ja, met licht- en trilsensor', 'Batterij-indicator', 'Oplader: Oplaadstation']",42.99,,https://www.kruidvat.nl/,True,False,[],4.6,521,bol.com,P&G,NL,Search,20,https://www.bol.com/nl/nl/s/?searchtext=elektrische+tandenborstel,1
9300000000290851,Philips Sonicare DiamondClean 9000 HX9914/55 - Elektrische tandenborstel - Wit - 2 stuks,4 poeststanden en 3 intensiteiten | Opladen in stijlvol glas of oplaadstation,Philips,https://www.kruidvat.nl/nl/nl/p/philips-sonicare-diamondclean-9000-hx9914-55-elektrische-tandenborstel-wit-2-stuks/9300000000290851/,De bijzonder elegante sonische elektrische tandenborstel van Philips Sonicare. De Philips Sonicare HX9914/55…,"['Geschikt voor: Volwassenen', 'Inclusief timer: Ja', 'Sonisch: vibrerend', 'Ja, met trilsensor', 'Batterij-indicator', 'Oplader: Via glas | Oplaadstation']",205.99,,https://www.kruidvat.nl/,True,False,[],4.4,118,bol.com,P&G,NL,Search,21,https://www.bol.com/nl/nl/s/?searchtext=elektrische+tandenborstel,1
9200000113029947,Oral-B Kids Oplaadbare Elektrische Tandenborstel - 1 Handvat Met Disney Frozen 2 - Voor Kinderen Vanaf 3 Jaar,Met extra zachte borstelharen | Geschikt voor kinderen vanaf 3 jaar,Oral B,https://www.kruidvat.nl/nl/nl/p/oral-b-kids-oplaadbare-elektrische-tandenborstel-1-handvat-met-disney-frozen-2-voor-kinderen-vanaf-3-jaar/9200000113029947/,Let op: er is een verpakkingswijziging. Het kan zijn dat de verpakking afwijkt van de hoofdafbeelding.…,"['Geschikt voor: Kinderen', 'Inclusief timer: Nee', '2D: roterend', 'Nee', 'Batterij-indicator', 'Oplader: Oplaadstation']",23.79,,https://www.kruidvat.nl/,True,False,[],4.5,456,bol.com,P&G,NL,Search,22,https://www.bol.com/nl/nl/s/?searchtext=elektrische+tandenborstel,1
9200000092109411,Philips Sonicare ProtectiveClean 4300 HX6807/63 - Elektrische tandenborstel - Wit,Schonere tanden | Beschermt je tandvlees | Met twee poetsintensiteiten,Philips,https://www.kruidvat.nl/nl/nl/p/philips-sonicare-protectiveclean-4300-hx6807-63-elektrische-tandenborstel-wit/9200000092109411/,Help jouw gebit en tandvlees optimaal te beschermen met de Philips Sonicare ProtectiveClean HX6807/63.…,"['Geschikt voor: Volwassenen', 'Inclusief timer: Ja', 'Sonisch: vibrerend', 'Ja, met trilsensor', 'Batterij-indicator', 'Consumentenbond Beste uit de test - December 2018', 'Oplader: Oplaadstation']",54.99,"79,99",https://www.kruidvat.nl/,True,False,['31%'],4.4,163,bol.com,P&G,NL,Search,23,https://www.bol.com/nl/nl/s/?searchtext=elektrische+tandenborstel,1
9200000106235889,Oral-B Vitality 100 CrossAction - Elektrische Tandenborstel - Roze,Met 2 minuten timer,Oral,https://www.kruidvat.nl/nl/nl/p/oral-b-vitality-100-crossaction-elektrische-tandenborstel-roze/9200000106235889/,De essentiële tandenborstel voor dagelijkse reiniging Verwijdert meer tandplak dan een gewone manuele…,"['Geschikt voor: Volwassenen', 'Inclusief timer: Ja', '2D: roterend', 'Nee', 'Consumentenbond Beste koop - April 2020 | Consumentenbond Beste koop - December 2018', 'Oplader: Oplaadstation']",25.95,,https://www.kruidvat.nl/,True,False,[],4.4,1098,bol.com,P&G,NL,Search,24,https://www.bol.com/nl/nl/s/?searchtext=elektrische+tandenborstel,1
9300000004143487,Oral-B Kids - Frozen 2 - Elektrische Tandenborstel - Special Edition,Met extra zachte borstelharen | Geschikt voor kinderen vanaf 3 jaar,Oral B,https://www.kruidvat.nl/nl/nl/p/oral-b-kids-frozen-2-elektrische-tandenborstel-special-edition/9300000004143487/,Speciaal ontworpen om mild voor kinderen te zijn Ronde opzetborstel voor kleine mondjes De extra zachte…,"['Geschikt voor: Kinderen', 'Inclusief timer: Nee', '2D: roterend', 'Nee', 'Batterij-indicator', 'Oplader: Oplaadstation']",29.99,,https://www.kruidvat.nl/,True,False,[],4.5,456,bol.com,P&G,NL,Search,25,https://www.bol.com/nl/nl/s/?searchtext=elektrische+tandenborstel,1
9300000033562746,Bintoi® iSonic UV D600 - Elektrische Tandenborstel met UV-Sterilisator,Incl. 4 Opzetborstels | Gratis UV Reisetui | tot 1 Maand Batterijduur | 4 poetstanden | Smart Poetstimer,BINTOI,https://www.kruidvat.nl/nl/nl/p/bintoi-isonic-uv-d600-elektrische-tandenborstel-met-uv-sterilisator/9300000033562746/,"Doodt 99,9% van de bacteriën en virussen. Is het je ooit opgevallen dat onze dagelijks gebruikte tandenborstels…","['Geschikt voor: Volwassenen', 'Inclusief timer: Ja', 'Sonisch: vibrerend', 'Nee', 'Batterij-indicator', 'Oplader: Oplaadstation']",59.95,,https://www.kruidvat.nl/,True,False,[],4.7,56,bol.com,P&G,NL,Search,26,https://www.bol.com/nl/nl/s/?searchtext=elektrische+tandenborstel,1
9200000095256697,Oral-B Junior - Elektrische tandenborstel - Paars,Beschikt over een 2 minuten timer,Oral B,https://www.kruidvat.nl/nl/nl/p/oral-b-junior-elektrische-tandenborstel-paars/9200000095256697/,Betere gewoontes; schonere tanden; leuke kleuren maken poetsen leuk voor kinderen van 6 jaar en ouder…,"['Geschikt voor: Kinderen', 'Inclusief timer: Nee', '3D: roterend en vibrerend', 'Nee', 'Batterij-indicator', 'Oplader: Oplaadstation']",31.99,,https://www.kruidvat.nl/,True,False,[],4.6,177,bol.com,P&G,NL,Search,27,https://www.bol.com/nl/nl/s/?searchtext=elektrische+tandenborstel,1
9300000043847507,Philips Sonicare Series 3100 HX3675/15 - Elektrische tandenborstel - Zwart & Roze - Duopack,Vergeet jouw handtandenborstel. Poets met sonische technologie. | Tot 3 keer betere tandplakverwijdering,Philips,https://www.kruidvat.nl/nl/nl/p/philips-sonicare-series-3100-hx3675-15-elektrische-tandenborstel-zwart-roze-duopack/9300000043847507/,In combinatie met de Sonische technologie en de werking van de opzetborstels verwijdert de Philips Sonicare…,"['Geschikt voor: Volwassenen', 'Inclusief timer: Ja', 'Sonisch: vibrerend', 'Ja, met trilsensor', 'Batterij-indicator', 'Oplader: Oplaadstation']",59.99,,https://www.kruidvat.nl/,True,False,[],4.6,24,bol.com,P&G,NL,Search,28,https://www.bol.com/nl/nl/s/?searchtext=elektrische+tandenborstel,1
9300000004662528,Oral-B iO 9n - Elektrische Tandenborstel - Zwart,Nieuwste Oral-B elektrische tandenborstel met revolutionaire magnetische technologie Powered By Braun,Oral B,https://www.kruidvat.nl/nl/nl/p/oral-b-io-9n-elektrische-tandenborstel-zwart/9300000004662528/,De beste reiniging ooit van Oral-B met revolutionaire magnetische iO technologie voor een professioneel…,"['Geschikt voor: Volwassenen', 'Inclusief timer: Ja', '3D magnetisch: roterend, vibrerend en pulserend', 'Ja, met licht- en trilsensor', 'Batterij-indicator', 'Consumentenbond Beste uit de test - December 2020', 'Oplader: Oplaadstation']",219.00,,https://www.kruidvat.nl/,True,True,[],4.7,105,bol.com,P&G,NL,Search,29,https://www.bol.com/nl/nl/s/?searchtext=elektrische+tandenborstel,1
9300000005039424,Oral-B Smart 4 4500 - Wit - Elektrische Tandenborstel,"Verbindt met de Oral-B app, waardoor Smart Coaching mogelijk wordt",Oral B,https://www.kruidvat.nl/nl/nl/p/oral-b-smart-4-4500-wit-elektrische-tandenborstel/9300000005039424/,Tot 100% meer tandplakverwijdering: ronde borstelkop reinigt beter en zorgt voor gezonder tandvlees Betere…,"['Geschikt voor: Volwassenen', 'Inclusief timer: Ja', '3D: roterend en vibrerend', 'Ja, met licht- en trilsensor', 'Batterij-indicator', 'Oplader: Oplaadstation']",75.00,,https://www.kruidvat.nl/,True,True,[],4.5,65,bol.com,P&G,NL,Search,30,https://www.bol.com/nl/nl/s/?searchtext=elektrische+tandenborstel,1
9200000115917188,Philips Shaver 1000 S1332/41 - Scheerapparaat,4D Flexibele scheerhoofden volgen de contouren van uw gezicht voor een glad scheerresultaat,Philips,https://www.kruidvat.nl/nl/nl/p/philips-shaver-1000-s1332-41-scheerapparaat/9200000115917188/,De Philips Shaver Series 1000 heeft een toegankelijke prijs en is gemakkelijk in gebruik. Het apparaat…,"['Meegeleverd: Beschermkap', 'Type baardgroei: Licht | Middel', '60 minuten draadloos te gebruiken', 'Afspoelbaar', 'Zelfslijpende messen']",41.99,,https://media.s-bol.com/qYyq4RjnL45k/78x210.jpg,True,False,[],4.3,206,bol.com,P&G,NL,Search,1,https://www.bol.com/nl/nl/s/?searchtext=scheerapparaat,1
9200000101800950,Philips AquaTouch S5050/04 -  Scheerapparaat,Beschermt 10x beter dan een standaardmesje,Philips,https://www.kruidvat.nl/nl/nl/p/philips-aquatouch-s5050-04-scheerapparaat/9200000101800950/,De Philips AquaTouch geeft een fantastisch glad scheerresultaat. Ook op de gevoelige huid. Het apparaat…,"['Meegeleverd: Precisietrimmer | Beschermkap', 'Type baardgroei: Middel', '30 minuten draadloos te gebruiken', 'Afspoelbaar', 'geschikt voor nat scheren', 'Zelfslijpende messen']",72.50,,https://www.kruidvat.nl/,True,False,[],4.4,38,bol.com,P&G,NL,Search,2,https://www.bol.com/nl/nl/s/?searchtext=scheerapparaat,1
