sku,title,sub_title,brand,product_url,description,product_specification,price,old_price,image,in_stock,is_sponsored,discount_value,rating,reviews,e_retailer,client,market,type,position,listing_url,page
9200000133139498,Men's Master Shaving Foam - Extra Dikke Scheerschuim met Groene Thee en Aloë Vera - Gevoelige Huid - 200ML,,Men's Master,https://www.kruidvat.nl/nl/nl/p/men-s-master-shaving-foam-extra-dikke-scheerschuim-met-groene-thee-en-aloe-vera-gevoelige-huid-200ml/9200000133139498/,"Last van irritatie en roodheid bij het scheren? Waarschijnlijk moet je een dikkere scheerschuim gebruiken,…","['200 ml', 'Huidtype: Alle huidtypes | Gevoelige huid | Normale huid | Droge huid | Vette huid | Rijpe huid', 'Voor mannen']",9.99,,https://www.kruidvat.nl/,True,False,[],5.0,1,bol.com,P&G,NL,Search,26,https://www.bol.com/nl/nl/s/?searchtext=scheerschuim,1
9200000059386306,Muhle Scheerzeep Aloe Vera Navulling 65 gr.,,Mühle,https://www.kruidvat.nl/nl/nl/p/muhle-scheerzeep-aloe-vera-navulling-65-gr/9200000059386306/,Muhle Scheerzeep Aloe Vera Navulling is een rijke en lichte scheerzeep om comfortabel nat te kunnen scheren.…,"['65 ml', 'Huidtype: Alle huidtypes', 'Voor unisex']",10.99,,https://www.kruidvat.nl/,True,False,[],Er zijn nog geen beoordelingen voor dit product.,,bol.com,P&G,NL,Search,27,https://www.bol.com/nl/nl/s/?searchtext=scheerschuim,1
9200000087063307,Gillette Series Sensitive Cool Scheerschuim Voor Mannen 250 ml,,Gillette,https://www.kruidvat.nl/nl/nl/p/gillette-series-sensitive-cool-scheerschuim-voor-mannen-250-ml/9200000087063307/,"Scheerschuim met een formule met een drievoudige werking: hydrateert, beschermt en kalmeert Hydrateert…","['250 ml', 'Huidtype: Gevoelige huid', 'Voor mannen']",16.49,"21,54",https://www.kruidvat.nl/,True,False,['23%'],4.6,9,bol.com,P&G,NL,Search,28,https://www.bol.com/nl/nl/s/?searchtext=scheerschuim,1
9300000004371914,Juuls Vegan Care - Scheerzeep - Lemongrass & Orange -  Halal - Plastic Vrij - Gratis Blikje - 75 gr,,Juuls,https://www.kruidvat.nl/nl/nl/p/juuls-vegan-care-scheerzeep-lemongrass-orange-halal-plastic-vrij-gratis-blikje-75-gr/9300000004371914/,"Op zoek naar de meest zacht schuimende, lekker fris ruikende, lang meegaande scheerschuim die ook nog…","['75 ml', 'Huidtype: Alle huidtypes', 'Voor mannen']",18.99,,https://www.kruidvat.nl/,True,True,[],4.5,2,bol.com,P&G,NL,Search,29,https://www.bol.com/nl/nl/s/?searchtext=scheerschuim,1
9300000032175530,"Australian Bodycare intim Shave 200ml - Intieme Scheergel met Tea Tree Olie voor ingegroeide haartjes, Irritatie & Stoppels, voor het scheren van de Bikinilijn en het Scheren van de Intieme zone, pH-Neutraal",,Australian Bodycare,https://www.kruidvat.nl/nl/nl/p/australian-bodycare-intim-shave-200ml-intieme-scheergel-met-tea-tree-olie-voor-ingegroeide-haartjes-irritatie-stoppels-voor-het-scheren-van-de-bikinilijn-en-het-scheren-van-de-intieme-zone-ph-neutraal/9300000032175530/,Transparante scheergel voor intiem scheren | Gaat bacteriën tegen in de intieme zone tijdens het scheren…,"['200 ml', 'Huidtype: Vette huid | Rijpe huid | Onzuivere huid | Normale huid | Gevoelige huid | Geirriteerde huid | Gecombineerde huid | Droge huid | Alle huidtypes | Allergische huid', 'Voor unisex']",15.99,,https://www.kruidvat.nl/,True,True,[],3.2,5,bol.com,P&G,NL,Search,30,https://www.bol.com/nl/nl/s/?searchtext=scheerschuim,1
9200000102170774,Pampers Sensitive Billendoekjes - 1200 doekjes,,Pampers,https://www.kruidvat.nl/nl/nl/p/pampers-sensitive-billendoekjes-1200-doekjes/9200000102170774/,Reinigt de huid mild en biedt de vertrouwde huidbescherming van Pampers De unieke pH-gebalanceerde formule…,['Huidtype: Alle huidtypes'],23.99,,https://media.s-bol.com/mY70g4Dn1N2n/168x181.jpg,True,False,['58%'],4.5,138,bol.com,P&G,NL,Search,1,https://www.bol.com/nl/nl/s/?searchtext=babydoekjes,1
9200000106455533,Pampers Aqua Pure Billendoekjes - 864 doekjes,,Pampers,https://www.kruidvat.nl/nl/nl/p/pampers-aqua-pure-billendoekjes-864-doekjes/9200000106455533/,"Let op: om de hoge vraag van de consumenten te kunnen beantwoorden, zijn er tijdelijk ook verpakkingen…",['Huidtype: Alle huidtypes'],25.75,,https://www.kruidvat.nl/,True,False,['50%'],4.5,377,bol.com,P&G,NL,Search,2,https://www.bol.com/nl/nl/s/?searchtext=babydoekjes,1
9300000040058700,Pura 100% Plasticvrije Doorspoelbare Babydoekjes - 700 doekjes,,Pura,https://www.kruidvat.nl/nl/nl/p/pura-100-plasticvrije-doorspoelbare-babydoekjes-700-doekjes/9300000040058700/,"Pura Doorspoelbare 100% plasticvrije Babydoekjes – 700 doekjes Als we doorspoelen zeggen, bedoelen we…",['Huidtype: Alle huidtypes'],38.99,,https://media.s-bol.com/gQmB4xMzQDZD/gLomlWY/168x111.jpg,True,True,[],Er zijn nog geen beoordelingen voor dit product.,,bol.com,P&G,NL,Search,3,https://www.bol.com/nl/nl/s/?searchtext=babydoekjes,1
9300000040058704,Pura 100% Plasticvrije Biologisch Afbreekbare Babydoekjes - 700 doekjes,,Pura,https://www.kruidvat.nl/nl/nl/p/pura-100-plasticvrije-biologisch-afbreekbare-babydoekjes-700-doekjes/9300000040058704/,"Pura 100% plasticvrije, biologisch afbreekbare babydoekjes - 700 doekjes De niet-doorspoelbare babydoekjes…",['Huidtype: Alle huidtypes'],32.99,,https://www.kruidvat.nl/,True,True,[],Er zijn nog geen beoordelingen voor dit product.,,bol.com,P&G,NL,Search,4,https://www.bol.com/nl/nl/s/?searchtext=babydoekjes,1
9300000007894926,Zwitsal Lotion Billendoekjes - 1755 billendoekjes - Voordeelverpakking,,Zwitsal,https://www.kruidvat.nl/nl/nl/p/zwitsal-lotion-billendoekjes-1755-billendoekjes-voordeelverpakking/9300000007894926/,Zwitsal Lotion Billendoekjes zijn bedoeld voor de normale babyhuid en hebben een mild reinigende werking.…,['Huidtype: Alle huidtypes | Allergische huid | Gevoelige huid'],46.49,,https://www.kruidvat.nl/,True,False,['38%'],4.7,533,bol.com,P&G,NL,Search,5,https://www.bol.com/nl/nl/s/?searchtext=babydoekjes,1
9300000022653928,Pampers Aqua Pure Billendoekjes – 1260 doekjes,,Pampers,https://www.kruidvat.nl/nl/nl/p/pampers-aqua-pure-billendoekjes-1260-doekjes/9300000022653928/,Gemaakt met 99% puur water om de huid zacht te reinigen Gemaakt met biologisch katoen zodat het zacht…,['Huidtype: Gevoelige huid'],35.61,,https://www.kruidvat.nl/,True,False,['53%'],4.5,377,bol.com,P&G,NL,Search,6,https://www.bol.com/nl/nl/s/?searchtext=babydoekjes,1
9200000102550207,Pampers Fresh Clean Billendoekjes - 1200 doekjes,,Pampers,https://www.kruidvat.nl/nl/nl/p/pampers-fresh-clean-billendoekjes-1200-doekjes/9200000102550207/,"Milde reiniging van de billetjes, handjes en het gezicht Helpt de natuurlijke pH-waarde van de huid te…",['Huidtype: Alle huidtypes'],24.99,,https://www.kruidvat.nl/,True,False,['57%'],4.8,1088,bol.com,P&G,NL,Search,7,https://www.bol.com/nl/nl/s/?searchtext=babydoekjes,1
9300000011858502,Pampers Pure Coconut Billendoekjes - 756 doekjes,,Pampers,https://www.kruidvat.nl/nl/nl/p/pampers-pure-coconut-billendoekjes-756-doekjes/9300000011858502/,"Babydoekjes met kokosolie om te reinigen en hydrateren 100% plantaardige vezels van duurzame oorsprong,…",['Huidtype: Gevoelige huid'],20.07,,https://www.kruidvat.nl/,True,False,['61%'],3.9,77,bol.com,P&G,NL,Search,8,https://www.bol.com/nl/nl/s/?searchtext=babydoekjes,1
9200000089243401,Huggies billendoekjes - Pure 99% water - 18 x 56 stuks - 1008 doekjes,"Voor gevoelige huidjes, 99% puur water!",Huggies,https://www.kruidvat.nl/nl/nl/p/huggies-billendoekjes-pure-99-water-18-x-56-stuks-1008-doekjes/9200000089243401/,"Huggies Babydoekjes Pure 99% water, 56 stuks x 18 verpakkingen - Voordeelverpakking Huggies babydoekjes…",['Huidtype: Gevoelige huid'],17.50,,https://www.kruidvat.nl/,True,False,['33%'],4.3,80,bol.com,P&G,NL,Search,9,https://www.bol.com/nl/nl/s/?searchtext=babydoekjes,1
9200000074444623,Neutral Baby Billendoekjes Parfumvrij - 1008 stuks - Voordeelverpakking,,Neutral,https://www.kruidvat.nl/nl/nl/p/neutral-baby-billendoekjes-parfumvrij-1008-stuks-voordeelverpakking/9200000074444623/,"Neutral babydoekjes zijn speciaal ontwikkeld voor gevoelige babybilletjes, -handjes en -gezichtjes. Neutral…",['Huidtype: Gevoelige huid'],35.88,,https://www.kruidvat.nl/,True,False,['25%'],4.6,506,bol.com,P&G,NL,Search,10,https://www.bol.com/nl/nl/s/?searchtext=babydoekjes,1
9200000090257558,Zwitsal Baby Billendoekjes Sensitive - 24 x 57 stuks - Voordeelverpakking,,Zwitsal,https://www.kruidvat.nl/nl/nl/p/zwitsal-baby-billendoekjes-sensitive-24-x-57-stuks-voordeelverpakking/9200000090257558/,Zwitsal Sensitive Billendoekjes zijn speciaal ontwikkeld om de gevoelige babyhuid op milde wijze schoon…,['Huidtype: Gevoelige huid'],40.99,,https://www.kruidvat.nl/,True,False,['39%'],4.7,533,bol.com,P&G,NL,Search,11,https://www.bol.com/nl/nl/s/?searchtext=babydoekjes,1
9300000007894930,Zwitsal Sensitive Billendoekjes - 1539 billendoekjes - Voordeelverpakking,,Zwitsal,https://www.kruidvat.nl/nl/nl/p/zwitsal-sensitive-billendoekjes-1539-billendoekjes-voordeelverpakking/9300000007894930/,Zwitsal Sensitive Billendoekjes zijn bedoeld voor de gevoelige babyhuid en hebben een mild reinigende…,['Huidtype: Alle huidtypes | Allergische huid | Gevoelige huid'],46.49,,https://www.kruidvat.nl/,True,False,['38%'],4.7,533,bol.com,P&G,NL,Search,12,https://www.bol.com/nl/nl/s/?searchtext=babydoekjes,1
9300000040895990,WaterWipes Billendoekjes Bio - 12 x 60 stuks - 720 doekjes,,WaterWipes,https://www.kruidvat.nl/nl/nl/p/waterwipes-billendoekjes-bio-12-x-60-stuks-720-doekjes/9300000040895990/,WaterWipes Billendoekjes Baby - Voordeeldoos 12 x 60 stuks - Plasticvrij - Gevoelige huid voordeelverpakking…,['Huidtype: Alle huidtypes'],36.99,,https://www.kruidvat.nl/,True,False,[],3.0,35,bol.com,P&G,NL,Search,13,https://www.bol.com/nl/nl/s/?searchtext=babydoekjes,1
9200000090262967,Zwitsal Lotion Billendoekjes - 24 x 65 stuks - Voordeelverpakking,,Zwitsal,https://www.kruidvat.nl/nl/nl/p/zwitsal-lotion-billendoekjes-24-x-65-stuks-voordeelverpakking/9200000090262967/,Zwitsal Lotion Billendoekjes zijn verrijkt met milde reinigingslotion en bestanddelen van zinkzalf en…,['Huidtype: Alle huidtypes'],46.87,,https://www.kruidvat.nl/,True,False,['30%'],4.7,533,bol.com,P&G,NL,Search,14,https://www.bol.com/nl/nl/s/?searchtext=babydoekjes,1
9200000112216749,WaterWipes 12x 60 babydoekjes (720 billendoekjes),"Bestaat voor 99,9 procent water en een druppel fruit extract",WaterWipes,https://www.kruidvat.nl/nl/nl/p/waterwipes-12x-60-babydoekjes/9200000112216749/,"WaterWipes babydoekjes, grotendeels op waterbasis. Het bevat slechts twee ingrediënten: 99,9% gezuiverd…",['Huidtype: Alle huidtypes'],36.88,,https://www.kruidvat.nl/,True,False,[],4.8,80,bol.com,P&G,NL,Search,15,https://www.bol.com/nl/nl/s/?searchtext=babydoekjes,1
9200000081184436,Huggies billendoekjes - Natural Care - 10 x 56 stuks -  560 doekjes,"Verrijkt met Aloë Vera en vitamine E, 0% phenoxyethanol en 0% parabenen.",Huggies,https://www.kruidvat.nl/nl/nl/p/huggies-billendoekjes-natural-care-10-x-56-stuks-560-doekjes/9200000081184436/,"Of het nu gaat om het zachtjes reinigen van uw baby's kwetsbare babyhuidje, of om het schoonmaken van…",['Huidtype: Gevoelige huid'],11.50,,https://www.kruidvat.nl/,True,False,['28%'],4.1,166,bol.com,P&G,NL,Search,16,https://www.bol.com/nl/nl/s/?searchtext=babydoekjes,1
9300000004775893,Naïf natuurlijke Plastic vrije billendoekjes - voordeelverpakking box 8 stuks - 54 doekjes per pak,babydoekjes voor de beste verzorging voor jouw baby en kind,Naïf,https://www.kruidvat.nl/nl/nl/p/naif-natuurlijke-plastic-vrije-billendoekjes-voordeelverpakking-box-8-stuks-54-doekjes-per-pak/9300000004775893/,Met plasticvrij bedoelen we ook echt plastic vrij. Van verpakking tot inhoud. Daarbij zijn de doekjes…,['Huidtype: Allergische huid | Gevoelige huid | Alle huidtypes'],20.00,,https://www.kruidvat.nl/,True,False,['28%'],4.4,19,bol.com,P&G,NL,Search,17,https://www.bol.com/nl/nl/s/?searchtext=babydoekjes,1
9300000027231998,Zwitsal Lotion Billendoekjes - 15 x 65 billendoekjes - Voordeelverpakking,,Zwitsal,https://www.kruidvat.nl/nl/nl/p/zwitsal-lotion-billendoekjes-15-x-65-billendoekjes-voordeelverpakking/9300000027231998/,Zwitsal Lotion Billendoekjes zijn bedoeld voor de normale babyhuid en hebben een mild reinigende werking.…,['Huidtype: Alle huidtypes'],29.04,,https://www.kruidvat.nl/,True,False,['30%'],5.0,5,bol.com,P&G,NL,Search,18,https://www.bol.com/nl/nl/s/?searchtext=babydoekjes,1
9200000120330663,Pampers Sensitive Billendoekjes 2400 stuks,,Pampers,https://www.kruidvat.nl/nl/nl/p/pampers-sensitive-billendoekjes-2400-stuks/9200000120330663/,Productbeschrijving • De unieke pH-gebalanceerde formule helpt de gevoelige huid van je baby te beschermen…,['Huidtype: Alle huidtypes'],46.90,,https://www.kruidvat.nl/,True,False,[],4.5,138,bol.com,P&G,NL,Search,19,https://www.bol.com/nl/nl/s/?searchtext=babydoekjes,1
9200000065623847,Zwitsal Frozen Snoetenpoetsers - 480 stuks - Voordeelverpakking,,Zwitsal,https://www.kruidvat.nl/nl/nl/p/zwitsal-frozen-snoetenpoetsers-480-stuks-voordeelverpakking/9200000065623847/,Zwitsal Kids Snoetenpoetsers Frozen zijn geschikt om op ieder moment van de dag vieze handjes en snoetjes…,['480 stuks in verpakking'],30.00,,https://www.kruidvat.nl/,True,False,[],4.5,92,bol.com,P&G,NL,Search,20,https://www.bol.com/nl/nl/s/?searchtext=babydoekjes,1
9300000027404825,Pampers Kids Hygiene On-The-Go doekjes - 600 doekjes,,Pampers,https://www.kruidvat.nl/nl/nl/p/pampers-kids-hygiene-on-the-go-doekjes-600-doekjes/9300000027404825/,Helpen vuil en bacteriën verwijderen Doekjes voor kinderen met een unieke formule op waterbasis met 2x…,['Huidtype: Alle huidtypes'],18.75,,https://www.kruidvat.nl/,True,False,['50%'],4.6,39,bol.com,P&G,NL,Search,21,https://www.bol.com/nl/nl/s/?searchtext=babydoekjes,1
9300000000788702,Pampers Billendoekjes Sensitive Navulpak - 12 x 52 doekjes,,Pampers,https://www.kruidvat.nl/nl/nl/p/pampers-billendoekjes-sensitive-navulpak-12-x-52-doekjes/9300000000788702/,Pampers Sensitive Babydoekjes 52 doekjes Reinigt de huid mild en biedt de vertrouwde huidbescherming…,['Huidtype: Alle huidtypes'],18.99,,https://www.kruidvat.nl/,True,False,[],5.0,2,bol.com,P&G,NL,Search,22,https://www.bol.com/nl/nl/s/?searchtext=babydoekjes,1
9300000022995888,Etos Baby Lotion Sensitive Billendoekjes Megabox - 1920 stuks (24x 80 stuks),,Etos,https://www.kruidvat.nl/nl/nl/p/etos-baby-lotion-sensitive-billendoekjes-megabox-1920-stuks/9300000022995888/,De Etos Baby Lotion Billendoekjes Sensitive vochtige doekjes reinigen en verzorgen de tere babybilletjes.…,['Huidtype: Gevoelige huid'],37.62,,https://www.kruidvat.nl/,True,False,['25%'],3.8,21,bol.com,P&G,NL,Search,23,https://www.bol.com/nl/nl/s/?searchtext=babydoekjes,1
9300000023365586,Etos Baby Lotion Mild Billendoekjes Megabox - 1920 stuks (24x 80 stuks),,Etos,https://www.kruidvat.nl/nl/nl/p/etos-baby-lotion-mild-billendoekjes-megabox-1920-stuks/9300000023365586/,Etos Baby Lotion Billendoekjes Mild vochtige doekjes reinigen en verzorgen op milde wijze de babybilletjes.…,['Huidtype: Alle huidtypes'],34.02,,https://www.kruidvat.nl/,True,False,['25%'],3.8,21,bol.com,P&G,NL,Search,24,https://www.bol.com/nl/nl/s/?searchtext=babydoekjes,1
9200000035786647,Neutral Baby Billendoekjes Parfumvrij - 8 x 63 stuks - Voordeelverpakking,,Neutral,https://www.kruidvat.nl/nl/nl/p/neutral-baby-billendoekjes-parfumvrij-8-x-63-stuks-voordeelverpakking/9200000035786647/,"Neutral babydoekjes zijn speciaal ontwikkeld voor gevoelige babybilletjes, -handjes en -gezichtjes. Neutral…",['Huidtype: Gevoelige huid'],19.14,,https://www.kruidvat.nl/,True,False,['20%'],4.6,506,bol.com,P&G,NL,Search,25,https://www.bol.com/nl/nl/s/?searchtext=babydoekjes,1
9200000117590645,Huggies billendoekjes - Pure Extra Care - 56 x 8 stuks -  (448 doekjes),"Sterke billendoekjes die bestaan uit 99% water, nu 30% DIKKER en 40% STERKER!",Huggies,https://www.kruidvat.nl/nl/nl/p/huggies-billendoekjes-pure-extra-care-56-x-8-stuks/9200000117590645/,"Niets is zo kwetsbaar als een babyhuidje, daarom verdient het de beste zorg en bescherming. Bij Huggies…",['Huidtype: Gevoelige huid'],19.27,,https://www.kruidvat.nl/,True,False,[],5.0,7,bol.com,P&G,NL,Search,26,https://www.bol.com/nl/nl/s/?searchtext=babydoekjes,1
9200000089230711,Andrélon Classic Iedere Dag Shampoo - 6 x 300 ml - Voordeelverpakking,,Andrélon,https://www.kruidvat.nl/nl/nl/p/andrelon-classic-iedere-dag-shampoo-6-x-300-ml-voordeelverpakking/9200000089230711/,Kijk! De nieuwe flessen van Andrélon. Gemaakt van 100% gerecycled plastic. Voor stralend haar. En beter…,"['1800 ml', 'Unisex', 'Normale shampoo', 'Flacon', 'Voor normaal haar', 'Volwassenen', 'Geen personage']",12.20,,https://media.s-bol.com/Q5ngP8lVZ2ZM/nrZpM95/168x170.jpg,True,False,['40%'],4.3,200,bol.com,P&G,NL,Search,1,https://www.bol.com/nl/nl/s/?searchtext=shampoo,1
9200000105474641,Olaplex Duo Pack No. 4 + No. 5 Shampoo en Conditioner - 2 x 250 ml,,Olaplex,https://www.kruidvat.nl/nl/nl/p/olaplex-duo-pack-no-4-no-5-shampoo-en-conditioner-2-x-250-ml/9200000105474641/,"Olaplex No. 5 Conditioner is geformuleerd met Olaplex Bond Building Chemistry. Het herstelt, repareert…","['500 ml', 'Unisex', 'Normale shampoo', 'Tube', 'Voor alle haartypes', 'Alle', 'Met conditioner']",42.00,,https://www.kruidvat.nl/,True,False,['15%'],3.4,16,bol.com,P&G,NL,Search,2,https://www.bol.com/nl/nl/s/?searchtext=shampoo,1
9200000089381638,DS Laboratories - Radia Purifying Shampoo - 205 ml,,DS Laboratories,https://www.kruidvat.nl/nl/nl/p/ds-laboratories-radia-purifying-shampoo-205-ml/9200000089381638/,DS laboratories Dandrene Anti Dandurff Shampoo helpt vanaf de eerste wasbeurt bij de bestrijding van…,"['205 ml', 'Vrouwen', 'Normale shampoo', 'Voor alle haartypes', 'Volwassenen']",22.95,,https://media.s-bol.com/AMyOP1wvQ17O/140x210.jpg,True,True,[],Er zijn nog geen beoordelingen voor dit product.,,bol.com,P&G,NL,Search,3,https://www.bol.com/nl/nl/s/?searchtext=shampoo,1
9300000003304440,Garnier Loving Blends Gember Boost Revitaliserende Shampoo - 6 x 300ml - Voor Slap en Futloos haar,,Garnier,https://www.kruidvat.nl/nl/nl/p/garnier-loving-blends-gember-boost-revitaliserende-shampoo-6-x-300ml-voor-slap-en-futloos-haar/9300000003304440/,Garnier Loving Blends Shampoo Gember Boost 300 ml Garnier Loving Blends Gember Boost shampoo is hèt recept…,"['300 ml', 'Unisex', 'Normale shampoo', 'Flacon', 'Voor normaal haar', 'Alle']",15.48,,https://www.kruidvat.nl/,True,True,['40%'],4.8,4,bol.com,P&G,NL,Search,4,https://www.bol.com/nl/nl/s/?searchtext=shampoo,1
9200000089230691,Andrélon Classic Shampoo Hair & Body - 6 x 300 ml - Voordeelverpakking,,Andrélon,https://www.kruidvat.nl/nl/nl/p/andrelon-classic-shampoo-hair-body-6-x-300-ml-voordeelverpakking/9200000089230691/,"Andrélon Men Hair & Body verrijkt met eucalyptus en aloë vera, biedt milde reiniging voor je haar en…","['1800 ml', 'Mannen', 'Normale shampoo', 'Flacon', 'Voor alle haartypes', 'Heren', 'Geen personage']",13.64,,https://www.kruidvat.nl/,True,False,['40%'],4.5,127,bol.com,P&G,NL,Search,5,https://www.bol.com/nl/nl/s/?searchtext=shampoo,1
9200000085036886,Fanola No Yellow Shampoo - 1000 ml,"Deze zilverShampoo bevat paarse pigmenten, waardoor de gele tint uit het haar verdwijnt.",Fanola,https://www.kruidvat.nl/nl/nl/p/fanola-no-yellow-shampoo-1000-ml/9200000085036886/,"Fanola No Yellow Shampoo is een zilvershampoo speciaal voor geblondeerd haar, haar met highlights en…","['1000 ml', 'Unisex', 'Zilvershampoo', 'Flacon', 'Voor normaal haar', 'Volwassenen']",13.03,,https://www.kruidvat.nl/,True,False,[],4.5,158,bol.com,P&G,NL,Search,6,https://www.bol.com/nl/nl/s/?searchtext=shampoo,1
9200000089230701,Andrélon Classic Glans Zomer Tarwe Shampoo - 6 x 300ml - Voordeelverpakking - Flacon - Unisex - Alle haartypes - Normale shampoo,,Andrélon,https://www.kruidvat.nl/nl/nl/p/andrelon-classic-glans-zomer-tarwe-shampoo-6-x-300ml-voordeelverpakking/9200000089230701/,Kijk! De nieuwe flessen van Andrélon. Gemaakt van 100% gerecycled plastic. Voor stralend haar. En beter…,"['1800 ml', 'Unisex', 'Normale shampoo', 'Flacon', 'Voor alle haartypes', 'Volwassenen']",12.20,,https://www.kruidvat.nl/,True,False,['40%'],4.4,67,bol.com,P&G,NL,Search,7,https://www.bol.com/nl/nl/s/?searchtext=shampoo,1
9200000089230713,Andrélon Classic For Men Iedere Dag Shampoo - 6 x 300 ml - Voordeelverpakking - Flacon - Mannen - Alle haartypes - Normale shampoo,,Andrélon,https://www.kruidvat.nl/nl/nl/p/andrelon-classic-for-men-iedere-dag-shampoo-6-x-300-ml-voordeelverpakking/9200000089230713/,Kijk! De nieuwe flessen van Andrélon. Gemaakt van 100% gerecycled plastic. Voor stralend haar. En beter…,"['1800 ml', 'Mannen', 'Normale shampoo', 'Flacon', 'Voor alle haartypes', 'Heren']",13.64,,https://www.kruidvat.nl/,True,False,['40%'],4.4,53,bol.com,P&G,NL,Search,8,https://www.bol.com/nl/nl/s/?searchtext=shampoo,1
9200000131171399,Andrélon Classic Perfecte Krul Shampoo - 6 x 300 ml - Voordeelverpakking,,Andrélon,https://www.kruidvat.nl/nl/nl/p/andrelon-classic-perfecte-krul-shampoo-6-x-300-ml-voordeelverpakking/9200000131171399/,"Je krullen voelen zacht, flexibel en veerkrachtig aan met Andrélon Classic Perfecte Krul Shampoo. Andrélon…","['1800 ml', 'Unisex', 'Normale shampoo', 'Flacon', 'Voor alle haartypes', 'Unisex']",14.36,,https://www.kruidvat.nl/,True,False,['40%'],4.4,113,bol.com,P&G,NL,Search,9,https://www.bol.com/nl/nl/s/?searchtext=shampoo,1
9200000032940084,Andrélon Classic Langer Fris Shampoo - 6 x 300 ml - Voordeelverpakking - Druppelaar - Vrouwen - Alle haartypes - Normale shampoo,,Andrélon,https://www.kruidvat.nl/nl/nl/p/andrelon-classic-langer-fris-shampoo-6-x-300-ml-voordeelverpakking/9200000032940084/,Kijk! De nieuwe flessen van Andrélon. Gemaakt van 100% gerecycled plastic. Voor stralend haar. En beter…,"['1800 ml', 'Vrouwen', 'Normale shampoo', 'Druppelaar', 'Voor alle haartypes', 'Vrouwen']",10.76,,https://www.kruidvat.nl/,True,False,['40%'],4.4,94,bol.com,P&G,NL,Search,10,https://www.bol.com/nl/nl/s/?searchtext=shampoo,1
9200000008555329,Alpecin  Caffeine Shampoo - 250 ml,,Alpecin,https://www.kruidvat.nl/nl/nl/p/alpecin-caffeine-shampoo-250-ml/9200000008555329/,Alpecin Cafeïne Shampoo C1 stimuleer je haargroei en maak fijn en futloos haar sterker met Alpecin Cafeïne…,"['250 ml', 'Unisex', 'Normale shampoo', 'Flacon', 'Voor alle haartypes', 'Mannen']",5.99,,https://www.kruidvat.nl/,True,False,[],4.4,71,bol.com,P&G,NL,Search,11,https://www.bol.com/nl/nl/s/?searchtext=shampoo,1
9200000099186585,Olaplex No. 4 Bond Maintenance Shampoo - 250 ml,Olaplex is de thuisbehandeling voor droog & beschadigd haar. Geef jouw haar een boost met Olaplex,Olaplex,https://www.kruidvat.nl/nl/nl/p/olaplex-no-4-bond-maintenance-shampoo-250-ml/9200000099186585/,Olaplex No. 4 Shampoo is geformuleerd met Olaplex Bond Building Chemistry om de sterkte en vochtigheidsgraad…,"['250 ml', 'Unisex', 'Normale shampoo', 'Flacon', 'Voor alle haartypes', 'Alle']",25.00,,https://www.kruidvat.nl/,True,False,[],4.3,21,bol.com,P&G,NL,Search,12,https://www.bol.com/nl/nl/s/?searchtext=shampoo,1
9200000114014848,Garnier Loving Blends Honing Goud Herstellende Shampoo - 6 x 300 ml - Voordeelverpakking,Een herstellende shampoo voor beschadigd en breekbaar haar,Garnier,https://www.kruidvat.nl/nl/nl/p/garnier-loving-blends-honing-goud-herstellende-shampoo-6-x-300-ml-voordeelverpakking/9200000114014848/,Garnier Loving Blends Shampoo - Honing Goud- 300 ml - Beschadigd of Breekbaar Haar Speciaal voor beschadigd…,"['1800 ml', 'Unisex', 'Normale shampoo', 'Flacon', 'Voor alle haartypes', 'Mannen & Vrouwen']",15.48,,https://www.kruidvat.nl/,True,False,['40%'],4.6,89,bol.com,P&G,NL,Search,13,https://www.bol.com/nl/nl/s/?searchtext=shampoo,1
9200000126123492,Shea Moisture Jamaican Black Castor Oil Restore Shampoo & Conditioner Set,,Shea Moisture,https://www.kruidvat.nl/nl/nl/p/shea-moisture-jamaican-black-castor-oil-restore-shampoo-conditioner-set/9200000126123492/,"Shea Moisture Jamaican Black Castor Oil Strengthen, Grow & Restore Shampoo een Claryfing, sulfaat vrije…","['384 ml', 'Unisex', 'Normale shampoo', 'Flacon', 'Voor alle haartypes | blondines | brunettes | kroeshaar | krullend haar | normaal haar', 'Volwassenen', 'Met conditioner']",23.99,,https://www.kruidvat.nl/,True,False,[],3.9,14,bol.com,P&G,NL,Search,14,https://www.bol.com/nl/nl/s/?searchtext=shampoo,1
9300000000306358,Andrélon Prinses Kids Shampoo - 6 x 300 ml - Voordeelverpakking,,Andrélon,https://www.kruidvat.nl/nl/nl/p/andrelon-prinses-kids-shampoo-6-x-300-ml-voordeelverpakking/9300000000306358/,"Andrélon Kids Prinses Shampoo, met de geur van aardbeien, is speciaal ontwikkeld voor het haar van kinderen…","['1800 ml', 'Meisjes', 'Normale shampoo', 'Flacon', 'Voor alle haartypes', 'Meisjes']",15.08,,https://www.kruidvat.nl/,True,True,['43%'],4.4,55,bol.com,P&G,NL,Search,15,https://www.bol.com/nl/nl/s/?searchtext=shampoo,1
9300000032175556,"Australian Bodycare Hair Clean + Mint 500 ml - Anti-roosshampoo met Tea Tree Olie + Mint - Shampoo voor een jeukende, schilferige en droge hoofdhuid - Voor de verzorging van de hoofdhuid bij psoriasis & eczeem - Tegen puistjes op de hoofdhuid - Vegan",,Australian Bodycare,https://www.kruidvat.nl/nl/nl/p/australian-bodycare-hair-clean-mint-500-ml-anti-roosshampoo-met-tea-tree-olie-mint-shampoo-voor-een-jeukende-schilferige-en-droge-hoofdhuid-voor-de-verzorging-van-de-hoofdhuid-bij-psoriasis-eczeem-tegen-puistjes-op-de-hoofdhuid-vegan/9300000032175556/,"Australian Bodycare Tea Tree Olie Shampoo | Shampoo tegen jeukende, schilferige, droge en geïrriteerde…","['500 ml', 'Unisex', 'Anti-roos', 'Flacon', 'Voor alle haartypes', 'Unisex']",15.99,,https://www.kruidvat.nl/,True,True,[],4.3,23,bol.com,P&G,NL,Search,16,https://www.bol.com/nl/nl/s/?searchtext=shampoo,1
