sku,title,sub_title,brand,product_url,description,product_specification,price,old_price,image,in_stock,is_sponsored,discount_value,rating,reviews,e_retailer,client,market,type,position,listing_url,page
9200000112317120,Elmex Sensitive Tandpasta 4 x 75ml - Voor Gevoelige Tanden - Voordeelverpakking,,Elmex,https://www.kruidvat.nl/nl/nl/p/elmex-sensitive-tandpasta-4-x-75ml-voor-gevoelige-tanden-voordeelverpakking/9200000112317120/,Let op: door een verpakkingswijziging kan de verpakking van het geleverde product afwijken van de afbeelding.…,"['Voor sterke tanden', 'Met fluoride', '4 stuk(s)']",15.52,,https://media.s-bol.com/gkr389oPAXJl/168x154.jpg,True,False,[],4.6,71,bol.com,P&G,NL,Search,1,https://www.bol.com/nl/nl/s/?searchtext=tandpasta,1
9300000034530970,Oral-B Pro-Expert Professional Protection Tandpasta - Voordeelverpakking - 4x75ml,,Oral B,https://www.kruidvat.nl/nl/nl/p/oral-b-pro-expert-professional-protection-tandpasta-voordeelverpakking-4x75ml/9300000034530970/,"De meest geavanceerde tandpasta van Oral-B, 24 uur bescherming tegen tandplak bij twee keer per dag poetsen…","['Voor glazuurbescherming', 'Met fluoride', '4 stuk(s)']",8.01,,https://www.kruidvat.nl/,True,False,['52%'],4.4,14,bol.com,P&G,NL,Search,2,https://www.bol.com/nl/nl/s/?searchtext=tandpasta,1
9300000031153240,Oral-B Pro-Expert Professionele Bescherming - Voordeelverpakking 4 x 125 ml - Tandpasta verpakt in gerecycleerd karton,,Oral B,https://www.kruidvat.nl/nl/nl/p/oral-b-pro-expert-professionele-bescherming-voordeelverpakking-4-x-125-ml-tandpasta-verpakt-in-gerecycleerd-karton/9300000031153240/,Tandpasta Oral-B Pro-Expert Professionele Bescherming verpakt in gerecycleerd karton De meest geavanceerde…,"['Voor glazuurbescherming', 'Met fluoride', '4 stuk(s)']",14.87,,https://media.s-bol.com/jngQwBwXLELR/156x210.jpg,True,True,['40%'],4.4,14,bol.com,P&G,NL,Search,3,https://www.bol.com/nl/nl/s/?searchtext=tandpasta,1
9300000031153241,Oral-B 3D White Luxe Perfection - Voordeelverpakking 4 x 100 ml -Tandpasta verpakt in gerecycleerd karton,,Oral B,https://www.kruidvat.nl/nl/nl/p/oral-b-3d-white-luxe-perfection-voordeelverpakking-4-x-100-ml-tandpasta-verpakt-in-gerecycleerd-karton/9300000031153241/,Tandpasta Oral-B 3D White Luxe Perfection verpakt in gerecycleerd karton Verwijdert tot 100% van de oppervlakkige…,"['Voor witte tanden', 'Met fluoride', '4 stuk(s)']",17.49,,https://www.kruidvat.nl/,True,True,['30%'],Er zijn nog geen beoordelingen voor dit product.,,bol.com,P&G,NL,Search,4,https://www.bol.com/nl/nl/s/?searchtext=tandpasta,1
9200000028884769,Aquafresh Freshmint - 5x 75 ml - Tandpasta - Voordeelverpakking,,Aquafresh,https://www.kruidvat.nl/nl/nl/p/aquafresh-freshmint-5x-75-ml-tandpasta-voordeelverpakking/9200000028884769/,Dè tandpasta voor het hele gezin. Aquafresh 3-voudige bescherming is verbeterd. De nieuwe glazuur+ formule…,"['Voor frisse adem', 'Met fluoride', '5 stuk(s)']",14.99,,https://www.kruidvat.nl/,True,False,[],4.5,61,bol.com,P&G,NL,Search,5,https://www.bol.com/nl/nl/s/?searchtext=tandpasta,1
9200000112317138,Colgate Tandpasta Caries Protection - 6 x 75 ml - Voordeelverpakking,Colgate tandpasta 6 stuks voordeelverpakking,Colgate,https://www.kruidvat.nl/nl/nl/p/colgate-tandpasta-caries-protection-6-x-75-ml-voordeelverpakking/9200000112317138/,Colgate Caries Protection Tandpasta 75 ml Colgate Caries Protection Tandpasta helpt gaatjes op de tanden…,"['Voor sterke tanden', 'Met fluoride', '6 stuk(s)']",11.94,,https://www.kruidvat.nl/,True,False,[],4.4,33,bol.com,P&G,NL,Search,6,https://www.bol.com/nl/nl/s/?searchtext=tandpasta,1
9300000024724257,Prodent Cool Mint Tandpasta - 12 x 75 ml - Voordeelverpakking,,Prodent,https://www.kruidvat.nl/nl/nl/p/prodent-cool-mint-tandpasta-12-x-75-ml-voordeelverpakking/9300000024724257/,Prodent Cool Mint tandpasta voor schone tanden en een frisse adem. Prodent Cool Mint Tandpasta is de…,"['Voor frisse adem | gezond tandvlees | glazuurbescherming | sterke tanden | witte tanden', 'Met fluoride', '12 stuk(s)']",16.00,,https://www.kruidvat.nl/,True,False,['33%'],4.4,51,bol.com,P&G,NL,Search,7,https://www.bol.com/nl/nl/s/?searchtext=tandpasta,1
9200000130146174,Sensodyne Repair & Protect - 2 X 75 ML- Tandpasta,,Sensodyne,https://www.kruidvat.nl/nl/nl/p/sensodyne-repair-protect-2-x-75-ml-tandpasta/9200000130146174/,Sensodyne Repair & Protect Extra Fresh Tandpasta helpt de kwetsbare plekken van de tand te herstellen…,"['Voor frisse adem', 'Met fluoride', '2 stuk(s)']",7.19,,https://www.kruidvat.nl/,True,False,['40%'],4.7,17,bol.com,P&G,NL,Search,8,https://www.bol.com/nl/nl/s/?searchtext=tandpasta,1
9200000112317114,Elmex Anti Caries Tandpasta 4 x 75ml - Voordeelverpakking,,Elmex,https://www.kruidvat.nl/nl/nl/p/elmex-anti-caries-tandpasta-4-x-75ml-voordeelverpakking/9200000112317114/,De zeer effectieve formule met aminfluoride vormt een tweevoudige actieve calcium-fluoride beschermlaag…,"['Voor sterke tanden', 'Met fluoride', '4 stuk(s)']",15.19,,https://www.kruidvat.nl/,True,False,[],4.2,33,bol.com,P&G,NL,Search,9,https://www.bol.com/nl/nl/s/?searchtext=tandpasta,1
9200000112317132,Elmex Junior 5-12 jaar Kindertandpasta 6 x 75ml - Voordeelverpakking,,Elmex,https://www.kruidvat.nl/nl/nl/p/elmex-junior-5-12-jaar-kindertandpasta-6-x-75ml-voordeelverpakking/9200000112317132/,Elmex Junior 5-12 Jaar Gel-Tandpasta 75 ml Deze Elmex Anti-caries tandpasta met zijn prettige smaak voor…,"['Voor sterke tanden', 'Met fluoride', '6 stuk(s)']",17.94,,https://www.kruidvat.nl/,True,False,[],4.7,39,bol.com,P&G,NL,Search,10,https://www.bol.com/nl/nl/s/?searchtext=tandpasta,1
9200000075880281,Oral-B 3D White Tandpasta - Voordeelverpakking - 4 x 75 ml,,Oral B,https://www.kruidvat.nl/nl/nl/p/oral-b-3d-white-tandpasta-voordeelverpakking-4-x-75-ml/9200000075880281/,Verwijdert tot 80% van de oppervlakkige verkleuringen Vertrouw je mond toe aan de Whitening expertise…,"['Voor witte tanden', 'Met fluoride', '4 stuk(s)']",12.87,,https://www.kruidvat.nl/,True,False,['25%'],4.7,19,bol.com,P&G,NL,Search,11,https://www.bol.com/nl/nl/s/?searchtext=tandpasta,1
9200000118814904,Sensodyne Gentle Whitening - 2 X 75 ML -Tandpasta,,Sensodyne,https://www.kruidvat.nl/nl/nl/p/sensodyne-gentle-whitening-2-x-75-ml-tandpasta/9200000118814904/,Sensodyne Gentle Whitening dagelijkse tandpasta geeft klinisch bewezen verlichting en dagelijkse bescherming…,"['Voor witte tanden', '2 stuk(s)']",5.75,,https://www.kruidvat.nl/,True,False,['40%'],4.2,32,bol.com,P&G,NL,Search,12,https://www.bol.com/nl/nl/s/?searchtext=tandpasta,1
9300000039493587,Parodontax Original - Tandpasta - tegen bloedend tandvlees - 2x75 ml,,Parodontax,https://www.kruidvat.nl/nl/nl/p/parodontax-original-tandpasta-tegen-bloedend-tandvlees-2x75-ml/9300000039493587/,Parodontax is speciaal ontwikkeld om tandplak te verwijderen. Het werkt doordat het de opbouw van tandplak…,"['Voor gezond tandvlees | sterke tanden | frisse adem', 'Met fluoride', '2 stuk(s)']",5.99,,https://www.kruidvat.nl/,True,False,['40%'],3.2,20,bol.com,P&G,NL,Search,13,https://www.bol.com/nl/nl/s/?searchtext=tandpasta,1
9200000090879972,GUM Red-Cote Plakverklikker Tabletten - 3 x 12 stuks - Voordeelverpakking,,Gum,https://www.kruidvat.nl/nl/nl/p/gum-red-cote-plakverklikker-tabletten-3-x-12-stuks-voordeelverpakking/9200000090879972/,GUM Red Cote Plakverklikkers laten door middel van een rood / paarse kleur zien of en waar nog tandplaque…,"['Voor sterke tanden', '36 stuk(s)']",5.01,,https://www.kruidvat.nl/,True,False,[],4.1,14,bol.com,P&G,NL,Search,14,https://www.bol.com/nl/nl/s/?searchtext=tandpasta,1
9300000024728430,Oral-B Pro-Expert Professional Protection Tandpasta - Voordeelverpakking 12 x 75ml,,Oral B,https://www.kruidvat.nl/nl/nl/p/oral-b-pro-expert-professional-protection-tandpasta-voordeelverpakking-12-x-75ml/9300000024728430/,"De meest geavanceerde tandpasta van Oral-B, 24 uur bescherming tegen tandplak bij twee keer per dag poetsen…","['Voor sterke tanden', 'Met fluoride', '12 stuk(s)']",30.17,,https://www.kruidvat.nl/,True,True,['40%'],3.3,4,bol.com,P&G,NL,Search,15,https://www.bol.com/nl/nl/s/?searchtext=tandpasta,1
9200000119810273,Colgate Max White Charcoal Whitening Tandpasta - 4 x 75 ml - Voordeelverpakking,,Colgate,https://www.kruidvat.nl/nl/nl/p/colgate-max-white-charcoal-whitening-tandpasta-4-x-75-ml-voordeelverpakking/9200000119810273/,Colgate Max White Charcoal Tandpasta bevat actieve houtskool en minerale microdeeltjes die je tanden…,"['Voor witte tanden', 'Met fluoride', '4 stuk(s)']",19.96,,https://www.kruidvat.nl/,True,True,[],4.3,32,bol.com,P&G,NL,Search,16,https://www.bol.com/nl/nl/s/?searchtext=tandpasta,1
9200000055832958,Eucryl Tandpoeder - Fresh Mint - 50 gram,,Eucryl,https://www.kruidvat.nl/nl/nl/p/eucryl-tandpoeder-fresh-mint-50-gram/9200000055832958/,"Eucryl Toothpowder laat vlekken en verkleuring van de tanden verdwijnen. Ouderwetse tandpoeder, was vroeger…","['Voor witte tanden', '1 stuk(s)']",6.90,,https://www.kruidvat.nl/,True,False,[],4.6,83,bol.com,P&G,NL,Search,17,https://www.bol.com/nl/nl/s/?searchtext=tandpasta,1
9200000116697423,Sensodyne Fresh Mint - 2 X 75 ML - Tandpasta,,Sensodyne,https://www.kruidvat.nl/nl/nl/p/sensodyne-fresh-mint-2-x-75-ml-tandpasta/9200000116697423/,Sensodyne Fresh Mint Tandpasta geeft klinisch bewezen verlichting en dagelijkse bescherming bij gevoelige…,"['Voor sterke tanden', 'Met fluoride', '2 stuk(s)']",5.75,,https://www.kruidvat.nl/,True,False,['40%'],4.7,24,bol.com,P&G,NL,Search,18,https://www.bol.com/nl/nl/s/?searchtext=tandpasta,1
9200000048720211,Oral-B Pro-Expert Professionele Bescherming - 4x75 ml - Tandpasta,Oral-B Pro-Expert Tandpasta  - 4x75ml,Oral B,https://www.kruidvat.nl/nl/nl/p/oral-b-pro-expert-professionele-bescherming-4x75-ml-tandpasta/9200000048720211/,"Bevat Tinfluoride Complex, een unieke combinatie van ingrediënten. Het beschermt en richt zich tegen…","['Voor sterke tanden', 'Met fluoride', '4 stuk(s)']",17.99,,https://www.kruidvat.nl/,True,False,[],4.7,271,bol.com,P&G,NL,Search,19,https://www.bol.com/nl/nl/s/?searchtext=tandpasta,1
9200000105544045,Prodent Fresh Gel Tandpasta - 12 x 75 ml - Voordeelverpakking,,Prodent,https://www.kruidvat.nl/nl/nl/p/prodent-fresh-gel-tandpasta-12-x-75-ml-voordeelverpakking/9200000105544045/,Prodent Fresh Gel tandpasta met frisse muntsmaak voor een extra frisse adem. Prodent Fresh Gel tandpasta…,"['Voor frisse adem', '12 stuk(s)']",16.49,,https://www.kruidvat.nl/,True,False,['31%'],5.0,11,bol.com,P&G,NL,Search,20,https://www.bol.com/nl/nl/s/?searchtext=tandpasta,1
9200000056185848,Oxyfresh Super Relief Gel,"Oxyfresh verlichtende gel voor het genezen van ontstoken tandvlees, wondjes, aften en mondzweertjes",Oxyfresh,https://www.kruidvat.nl/nl/nl/p/oxyfresh-super-relief-gel/9200000056185848/,"OXYFRESH SUPER RELIEF GEL Oxyfresh Super Relief Gel herstelt ontstoken tandvlees, aften en wondjes. …","['Voor gezond tandvlees', '1 stuk(s)']",19.95,,https://www.kruidvat.nl/,True,False,[],3.9,32,bol.com,P&G,NL,Search,21,https://www.bol.com/nl/nl/s/?searchtext=tandpasta,1
9200000112317116,Elmex Sensitive Professional Tandpasta - 2 x 75 ml - Voordeelverpakking,,Elmex,https://www.kruidvat.nl/nl/nl/p/elmex-sensitive-professional-tandpasta-2-x-75-ml-voordeelverpakking/9200000112317116/,De exclusieve formule van elmex sensitive professional tandpasta die is gebaseerd op de klinisch bewezen…,"['Voor sterke tanden', 'Met fluoride', '2 stuk(s)']",9.99,,https://www.kruidvat.nl/,True,False,['17%'],4.5,31,bol.com,P&G,NL,Search,22,https://www.bol.com/nl/nl/s/?searchtext=tandpasta,1
9200000130146178,Sensodyne Rapid Relief - 2 X 75 ML- Tandpasta,,Sensodyne,https://www.kruidvat.nl/nl/nl/p/sensodyne-rapid-relief-2-x-75-ml-tandpasta/9200000130146178/,Sensodyne Rapid Relief Tandpasta voor Gevoelige Tanden Klinisch bewezen tandpasta voor een snelle verlichting…,"['Voor frisse adem', 'Met fluoride', '2 stuk(s)']",7.19,,https://www.kruidvat.nl/,True,False,['40%'],4.3,29,bol.com,P&G,NL,Search,23,https://www.bol.com/nl/nl/s/?searchtext=tandpasta,1
9200000112659488,Elmex Peuter (0 tot 5 jaar) Kindertandpasta 6 x 75ml - Voordeelverpakking,,Elmex,https://www.kruidvat.nl/nl/nl/p/elmex-peuter-kindertandpasta-6-x-75ml-voordeelverpakking/9200000112659488/,De elmex Anti-Cariës Peuter 0-5 jaar kindertandpasta beschermt het melkgebit tegen gaatjes. Goede mondverzorging…,"['Voor sterke tanden', 'Met fluoride', '6 stuk(s)']",16.99,,https://www.kruidvat.nl/,True,False,[],4.3,36,bol.com,P&G,NL,Search,24,https://www.bol.com/nl/nl/s/?searchtext=tandpasta,1
9200000112317142,Colgate Blue Fresh Gel Tandpasta 6 x 75ml - Voordeelverpakking,,Colgate,https://www.kruidvat.nl/nl/nl/p/colgate-blue-fresh-gel-tandpasta-6-x-75ml-voordeelverpakking/9200000112317142/,Colgate Fresh Gel tandpasta helpt gaatjes voorkomen en geeft een fris en schoon gevoel. Het is klinisch…,"['Voor frisse adem', 'Met fluoride', '6 stuk(s)']",11.94,,https://www.kruidvat.nl/,True,False,[],4.5,32,bol.com,P&G,NL,Search,25,https://www.bol.com/nl/nl/s/?searchtext=tandpasta,1
9200000131437983,Zendium Classic Tandpasta - 12 x 75 ml - Voordeelverpakking,,Zendium,https://www.kruidvat.nl/nl/nl/p/zendium-classic-tandpasta-12-x-75-ml-voordeelverpakking/9200000131437983/,"Zendium Classic tandpasta - natuurlijke bescherming, wetenschappelijk bewezen. Zendium Classic tandpasta…","['Voor sterke tanden | gezond tandvlees', 'Met fluoride', '12 stuk(s)']",30.47,,https://www.kruidvat.nl/,True,False,['33%'],4.4,67,bol.com,P&G,NL,Search,26,https://www.bol.com/nl/nl/s/?searchtext=tandpasta,1
9300000039493589,Parodontax Whitening - Tandpasta - tegen bloedend tandvlees - 2x75 ml,,Parodontax,https://www.kruidvat.nl/nl/nl/p/parodontax-whitening-tandpasta-tegen-bloedend-tandvlees-2x75-ml/9300000039493589/,Parodontax is speciaal ontwikkeld om tandplak te verwijderen. Het werkt doordat het de opbouw van tandplak…,"['Voor witte tanden | sterke tanden | gezond tandvlees', 'Met fluoride', '2 stuk(s)']",5.99,,https://www.kruidvat.nl/,True,False,['40%'],3.8,19,bol.com,P&G,NL,Search,27,https://www.bol.com/nl/nl/s/?searchtext=tandpasta,1
9200000112167666,Vitis Whitening Tandpasta 4 Pack,,Vitis,https://www.kruidvat.nl/nl/nl/p/vitis-whitening-tandpasta-4-pack/9200000112167666/,"Vitis Whitening Tandpasta voor witte tanden Natuurlijk kun je, je tanden bleken om witte tanden te krijgen,…","['Voor witte tanden', 'Met fluoride', '4 stuk(s)']",27.50,,https://www.kruidvat.nl/,True,False,[],5.0,2,bol.com,P&G,NL,Search,28,https://www.bol.com/nl/nl/s/?searchtext=tandpasta,1
9300000024728442,Oral-B Pro-Expert Bescherming Gevoelige Tanden Tandpasta - Voordeelverpakking 12 x 75ml,,Oral B,https://www.kruidvat.nl/nl/nl/p/oral-b-pro-expert-bescherming-gevoelige-tanden-tandpasta-voordeelverpakking-12-x-75ml/9300000024728442/,24 uur bescherming tegen tandplak bij twee keer per dag poetsen Versterkt actief door het glazuur te…,"['Voor gezond tandvlees', 'Met fluoride', '12 stuk(s)']",26.09,,https://www.kruidvat.nl/,True,True,['48%'],5.0,1,bol.com,P&G,NL,Search,29,https://www.bol.com/nl/nl/s/?searchtext=tandpasta,1
9200000127569678,12x Oral-B Tandpasta PureActiv Glazuur Care 75 ml,,Oral B,https://www.kruidvat.nl/nl/nl/p/12x-oral-b-tandpasta-pureactiv-glazuur-care-75-ml/9200000127569678/,Oral-B Tandpasta PureActiv Glazuur Care 75ml Geformuleerd met 0% kunstmatige kleurstoffen en 0% natriumlaurylsulfaat…,['12 stuk(s)'],32.33,,https://www.kruidvat.nl/,True,True,['40%'],4.5,29,bol.com,P&G,NL,Search,30,https://www.bol.com/nl/nl/s/?searchtext=tandpasta,1
9300000005719552,Oral-B CrossAction - Met CleanMaximiser-technologie - Opzetborstels - 4 Stuks,Verkleurt wanneer je opzetborstel aan vervanging toe is,Oral B,https://www.kruidvat.nl/nl/nl/p/oral-b-crossaction-met-cleanmaximiser-technologie-opzetborstels-4-stuks/9300000005719552/,Met de CleanMaximiser-technologie worden groene borstelharen geel wanneer het tijd is om je opzetborstel…,"['4 artikelen in verpakking', 'Borstel vorm: Rond']",12.99,,https://media.s-bol.com/gpL6z4yqR9YY/159x210.jpg,True,False,[],4.8,95,bol.com,P&G,NL,Search,1,https://www.bol.com/nl/nl/s/?searchtext=opzetborstels,1
9300000005719563,Oral-B CrossAction - Met CleanMaximiser-technologie - Opzetborstels - 10 Stuks,Verkleurt wanneer je opzetborstel aan vervanging toe is,Oral B,https://www.kruidvat.nl/nl/nl/p/oral-b-crossaction-met-cleanmaximiser-technologie-opzetborstels-10-stuks/9300000005719563/,Met de CleanMaximiser-technologie worden groene borstelharen geel wanneer het tijd is om je opzetborstel…,"['10 artikelen in verpakking', 'Borstel vorm: Rond']",29.30,,https://www.kruidvat.nl/,True,False,[],4.8,95,bol.com,P&G,NL,Search,2,https://www.bol.com/nl/nl/s/?searchtext=opzetborstels,1
9300000040884309,Profi Smile - Universele opzetborstels voor elektrische  Oral-b tandenborstels - 14 Stuks,,Profi Smile,https://www.kruidvat.nl/nl/nl/p/profi-smile-universele-opzetborstels-voor-elektrische-oral-b-tandenborstels-14-stuks/9300000040884309/,De ronde opzetborstels van Profi Smile zorgen voor schonere tanden en gezonder tandvlees tijdens het…,"['14 artikelen in verpakking', 'Borstel vorm: Rond']",20.95,,https://media.s-bol.com/YQGz7l43kxMp/VmkRlGv/168x163.jpg,True,True,[],4.5,13,bol.com,P&G,NL,Search,3,https://www.bol.com/nl/nl/s/?searchtext=opzetborstels,1
9300000033617168,Opzetborstels - 16 stuks - Geschikt voor Oral-B,,GottaGets,https://www.kruidvat.nl/nl/nl/p/opzetborstels-16-stuks-geschikt-voor-oral-b/9300000033617168/,De ronde opzetborstels van GottaGets zorgen voor schonere tanden en gezonder tandvlees tijdens het poetsen…,"['16 artikelen in verpakking', 'Borstel vorm: Rond']",25.95,,https://www.kruidvat.nl/,True,True,[],3.5,2,bol.com,P&G,NL,Search,4,https://www.bol.com/nl/nl/s/?searchtext=opzetborstels,1
9300000005039400,Oral-B Precision Clean- Met CleanMaximiser-technologie - Opzetborstels - 4 Stuks,Verkleurt wanneer je opzetborstel aan vervanging toe is,Oral B,https://www.kruidvat.nl/nl/nl/p/oral-b-precision-clean-met-cleanmaximiser-technologie-opzetborstels-4-stuks/9300000005039400/,Met de CleanMaximiser-technologie worden groene borstelharen geel wanneer het tijd is om je opzetborstel…,"['4 artikelen in verpakking', 'Borstel vorm: Rond']",12.95,,https://www.kruidvat.nl/,True,False,[],4.7,55,bol.com,P&G,NL,Search,5,https://www.bol.com/nl/nl/s/?searchtext=opzetborstels,1
9300000005719555,Oral-B CrossAction - Met CleanMaximiser-technologie - Opzetborstels - Zwart - 4stuks,Verkleurt wanneer je opzetborstel aan vervanging toe is,Oral B,https://www.kruidvat.nl/nl/nl/p/oral-b-crossaction-met-cleanmaximiser-technologie-opzetborstels-zwart-4stuks/9300000005719555/,Met de CleanMaximiser-technologie worden groene borstelharen geel wanneer het tijd is om je opzetborstel…,"['4 artikelen in verpakking', 'Borstel vorm: Rond']",21.26,,https://www.kruidvat.nl/,True,False,[],4.7,25,bol.com,P&G,NL,Search,6,https://www.bol.com/nl/nl/s/?searchtext=opzetborstels,1
9200000093803207,Philips Sonicare W2 Optimal White HX6068/12 - Opzetborstels - 8 stuks,Connected: handige herinnering voor vervanging opzetborstel | Compatibel met elk oplaadbare Philips Sonicare-tandenborstel | 8 stuks,Philips,https://www.kruidvat.nl/nl/nl/p/philips-sonicare-w2-optimal-white-hx6068-12-opzetborstels-8-stuks/9200000093803207/,De W2 Optimal White-opzetborstel is ideaal als je voor een grondige reiniging gaat die vlekken en verkleuringen…,"['8 artikelen in verpakking', 'Borstel vorm: Ovaal']",39.98,,https://www.kruidvat.nl/,True,False,[],4.7,40,bol.com,P&G,NL,Search,7,https://www.bol.com/nl/nl/s/?searchtext=opzetborstels,1
9300000004662517,Oral-B iO Ultimate Clean - Opzetborstels - Zwart - 4 Stuks,Exclusief ontworpen voor en gegarandeerd passend bij de Oral-B iO,Oral B,https://www.kruidvat.nl/nl/nl/p/oral-b-io-ultimate-clean-opzetborstels-zwart-4-stuks/9300000004662517/,"Ultimate Clean combineert de perfecte hoek van Oral-B met innovatieve nieuwe borstelharen, voor de beste…","['4 artikelen in verpakking', 'Borstel vorm: Rond']",38.90,,https://www.kruidvat.nl/,True,False,[],4.6,279,bol.com,P&G,NL,Search,8,https://www.bol.com/nl/nl/s/?searchtext=opzetborstels,1
9300000009588134,Oral-B Precision Clean - Met CleanMaximiser-technologie - Opzetborstels - 12 Stuks,Verkleurt wanneer je opzetborstel aan vervanging toe is,Oral B,https://www.kruidvat.nl/nl/nl/p/oral-b-precision-clean-met-cleanmaximiser-technologie-opzetborstels-12-stuks/9300000009588134/,De unieke borstelharen Precision Clean verwijderen tandplak voor een superieure tand-voor-tand reiniging…,"['12 artikelen in verpakking', 'Borstel vorm: Rond']",32.00,,https://www.kruidvat.nl/,True,False,[],4.7,55,bol.com,P&G,NL,Search,9,https://www.bol.com/nl/nl/s/?searchtext=opzetborstels,1
9300000005719554,Oral-B Sensitive Clean - Opzetborstels - 4 Stuks,Verkleurt wanneer je opzetborstel aan vervanging toe is,Oral B,https://www.kruidvat.nl/nl/nl/p/oral-b-sensitive-clean-opzetborstels-4-stuks/9300000005719554/,Combinatie van gewone borstelharen voor schonere tanden en ultradunne borstelharen voor gezonder tandvlees…,"['4 artikelen in verpakking', 'Borstel vorm: Rond']",15.89,,https://www.kruidvat.nl/,True,False,[],4.3,4,bol.com,P&G,NL,Search,10,https://www.bol.com/nl/nl/s/?searchtext=opzetborstels,1
9200000087577875,Philips Sonicare W2 Optimal White HX6064/11 - Opzetborstels - 4 stuks - Zwart,Connected: handige herinnering voor vervanging opzetborstel | Compatibel met elk oplaadbare Philips Sonicare-tandenborstel |4 stuks,Philips,https://www.kruidvat.nl/nl/nl/p/philips-sonicare-w2-optimal-white-hx6064-11-opzetborstels-4-stuks-zwart/9200000087577875/,De Optimal White-opzetborstel is ideaal als je voor een grondige reiniging gaat die vlekken en verkleuringen…,"['4 artikelen in verpakking', 'Borstel vorm: Ovaal']",23.99,,https://www.kruidvat.nl/,True,False,[],4.4,40,bol.com,P&G,NL,Search,11,https://www.bol.com/nl/nl/s/?searchtext=opzetborstels,1
9300000007893674,Oral-B Precision Clean - Met CleanMaximiser-technologie - Opzetborstels -10 Stuks - Brievenbusverpakking,Verkleurt wanneer je opzetborstel aan vervanging toe is,Oral B,https://www.kruidvat.nl/nl/nl/p/oral-b-precision-clean-met-cleanmaximiser-technologie-opzetborstels-10-stuks-brievenbusverpakking/9300000007893674/,Combinatie van gewone borstelharen voor schonere tanden en ultradunne borstelharen voor gezonder tandvlees…,"['10 artikelen in verpakking', 'Borstel vorm: Rond']",27.99,,https://www.kruidvat.nl/,True,False,[],4.7,55,bol.com,P&G,NL,Search,12,https://www.bol.com/nl/nl/s/?searchtext=opzetborstels,1
9200000079522231,Philips Sonicare C3 Premium Plaque Defense HX9044/17 - Opzetborstel - 4 stuks,Connected: handige herinnering voor vervanging opzetborstel | Compatibel met elk oplaadbare Philips Sonicare-tandenborstel | 4 stuks,Philips,https://www.kruidvat.nl/nl/nl/p/philips-sonicare-c3-premium-plaque-defense-hx9044-17-opzetborstel-4-stuks/9200000079522231/,Ons meest grondig reinigende opzetborstel helpt jou effectief tandplak bestrijden. Door onze adaptieve…,"['4 artikelen in verpakking', 'Borstel vorm: Ovaal']",23.95,,https://www.kruidvat.nl/,True,False,[],4.5,33,bol.com,P&G,NL,Search,13,https://www.bol.com/nl/nl/s/?searchtext=opzetborstels,1
9300000005719565,Oral-B 3D White - Met CleanMaximiser-technologie -  Opzetborstels - 4 Stuks,Verkleurt wanneer je opzetborstel aan vervanging toe is,Oral B,https://www.kruidvat.nl/nl/nl/p/oral-b-3d-white-met-cleanmaximiser-technologie-opzetborstels-4-stuks/9300000005719565/,Met de CleanMaximiser-technologie worden groene borstelharen geel wanneer het tijd is om je opzetborstel…,"['4 artikelen in verpakking', 'Borstel vorm: Rond']",14.09,,https://www.kruidvat.nl/,True,False,[],4.4,38,bol.com,P&G,NL,Search,14,https://www.bol.com/nl/nl/s/?searchtext=opzetborstels,1
9300000005719566,Oral-B Sensitive Clean - Opzetborstels - 8 Stuks,,Oral B,https://www.kruidvat.nl/nl/nl/p/oral-b-sensitive-clean-opzetborstels-8-stuks/9300000005719566/,Combinatie van gewone borstelharen voor schonere tanden en ultradunne borstelharen voor gezonder tandvlees…,"['8 artikelen in verpakking', 'Borstel vorm: Rond']",34.29,,https://www.kruidvat.nl/,True,True,[],4.3,10,bol.com,P&G,NL,Search,15,https://www.bol.com/nl/nl/s/?searchtext=opzetborstels,1
9300000005039423,Oral-B Precision Clean- Met CleanMaximiser-technologie - Opzetborstels - 3 Stuks,Verkleurt wanneer je opzetborstel aan vervanging toe is,Oral B,https://www.kruidvat.nl/nl/nl/p/oral-b-precision-clean-met-cleanmaximiser-technologie-opzetborstels-3-stuks/9300000005039423/,Met de CleanMaximiser-technologie worden groene borstelharen geel wanneer het tijd is om je opzetborstel…,"['3 artikelen in verpakking', 'Borstel vorm: Rond']",14.00,,https://www.kruidvat.nl/,True,True,[],4.7,55,bol.com,P&G,NL,Search,16,https://www.bol.com/nl/nl/s/?searchtext=opzetborstels,1
9200000087577879,Philips Sonicare InterCare standaard HX9004/10 - Opzetborstels - 4 stuks,Connected: handige herinnering voor vervanging opzetborstel | Compatibel met elk oplaadbare Philips Sonicare-tandenborstel | 4 stuks,Philips,https://www.kruidvat.nl/nl/nl/p/philips-sonicare-intercare-standaard-hx9004-10-opzetborstels-4-stuks/9200000087577879/,Met geavanceerde borsteltechnologie en extra lange borstelharen helpt de InterCare tot 7x meer plak tussen…,"['4 artikelen in verpakking', 'Borstel vorm: Ovaal']",19.00,,https://www.kruidvat.nl/,True,False,[],4.5,22,bol.com,P&G,NL,Search,17,https://www.bol.com/nl/nl/s/?searchtext=opzetborstels,1
